StockCode,ProductName,Count,LatestMonth,UnsoldDuration
84637,KITCHEN FLOWER POTS WALL PLAQUE,13,2011-09,3
84638,SMALL KITCHEN FLOWER POTS PLAQUE,12,2011-10,2
84658,WHITE STITCHED CUSHION COVER,18,2011-12,0
84665,SQUARE CHERRY BLOSSOM CABINET,20,2011-11,1
84666,SQUARE CHERRY BLOSSOM CABINET,4,2011-04,8
84674,FLYING PIG WATERING CAN,43,2011-12,0
84675,FROG KING WATERING CAN,2,2011-01,11
84678,CLASSICAL ROSE SMALL VASE,12,2011-03,9
84679,CLASSICAL ROSE TABLE LAMP,2,2011-12,0
84683,CLASSICAL ROSE CANDLESTAND,7,2011-05,7
84685,BEACH HUT KEY CABINET,10,2011-05,7
84686,BEACH HUT MIRROR,8,2011-07,5
84687,BEACH HUT SHELF W 3 DRAWERS,23,2011-11,1
84688,BEACH HUT DESIGN BLACKBOARD,10,2011-07,5
84689,S/2 BEACH HUT TREASURE CHESTS,2,2011-05,7
84691,PACK 20 DOLLY PEGS,4,2011-05,7
84692,BOX OF 24 COCKTAIL PARASOLS,377,2011-12,0
84715,SET OF 6 ICE CREAM SKITTLES,3,2011-04,8
84723,CHERRY BLOSSOM CANVAS ART PICTURE,6,2011-08,4
84725,FREESTYLE CANVAS ART PICTURE,18,2011-09,3
84731,3 BIRDS CANVAS SCREEN,2,2011-07,5
84744,S/6 SEW ON CROCHET FLOWERS,18,2011-11,1
84746,PINK EASTER HENS+FLOWER,1,2011-07,5
84748,FOLK FELT HANGING MULTICOL GARLAND,11,2011-11,1
84754,S/15 SILVER GLASS BAUBLES IN BAG,38,2011-09,3
84755,COLOUR GLASS T-LIGHT HOLDER HANGING,547,2011-12,0
84763,ZINC FINISH 15CM PLANTER POTS,49,2011-05,7
84766,SILVER ROCOCO CANDLE STICK,17,2011-11,1
84773,RED ROSE AND LACE C/COVER,1,2010-12,12
84789,ENCHANTED BIRD PLANT CAGE,44,2011-07,5
84792,ENCHANTED BIRD COATHANGER 5 HOOK,197,2011-12,0
84799,SPRIG LAVENDER ARTIFICIAL FLOWER,11,2011-03,9
84813,SET OF 4 DIAMOND NAPKIN RINGS,23,2011-12,0
84816,DANISH ROSE BEDSIDE CABINET,15,2011-08,4
84817,DANISH ROSE DECORATIVE PLATE,62,2011-12,0
84818,DANISH ROSE PHOTO FRAME,107,2011-10,2
84819,DANISH ROSE ROUND SEWING BOX,64,2011-12,0
84820,DANISH ROSE TRINKET TRAYS,33,2011-12,0
84821,DANISH ROSE DELUXE COASTER,43,2011-12,0
84823,DANISH ROSE FOLDING CHAIR,25,2011-02,10
84824,DANISH ROSE UMBRELLA STAND,2,2011-11,1
84826,ASSTD DESIGN 3D PAPER STICKERS,37,2011-12,0
84827,ASS DES PHONE SPONGE CRAFT STICKER,18,2011-12,0
84828,JUNGLE POPSICLES ICE LOLLY HOLDERS,17,2011-03,9
84828,JUNGLE POPSICLES ICE LOLLY MOULDS,101,2011-12,0
84832,ZINC WILLIE WINKIE  CANDLE STICK,193,2011-12,0
84836,ZINC METAL HEART DECORATION,493,2011-12,0
84839,SWEETHEART KEY CABINET,1,2011-04,8
84840,SWEETHEART CARRY-ALL BASKET,4,2011-03,9
84842,HELLO SAILOR BATHROOM SET,9,2011-11,1
84843,WHITE SOAP RACK WITH 2 BOTTLES,43,2011-12,0
84847,FLORAL BATHROOM SET,12,2011-08,4
84854,GIRLY PINK TOOL SET,1,2010-12,12
84865,NEW BAROQUE BLACK PHOTO ALBUM,12,2011-07,5
84879,ASSORTED COLOUR BIRD ORNAMENT,1418,2011-12,0
84880,WHITE WIRE EGG HOLDER,70,2011-12,0
84881,BLUE WIRE SPIRAL CANDLE HOLDER,6,2011-07,5
84882,GREEN WIRE STANDING CANDLE HOLDER,15,2011-11,1
84905,PINK BUTTERFLY CUSHION COVER ,2,2011-04,8
84906,PINK B'FLY C/COVER W BOBBLES,6,2011-03,9
84906,PINK BUTTERFLY CUSHION COVER,5,2011-06,6
84907,PINK YELLOW PATCH CUSHION COVER,3,2011-06,6
84915,HAND TOWEL PINK FLOWER AND DAISY,11,2011-11,1
84916,HAND TOWEL PALE BLUE W FLOWERS,18,2011-05,7
84917,WHITE HAND TOWEL WITH BUTTERFLY,14,2011-05,7
84919,BLUE CUSHION COVER WITH FLOWER,9,2011-06,6
84920,PINK FLOWER FABRIC PONY,27,2011-12,0
84921,CREAM AND PINK FLOWERS PONY ,5,2011-10,2
84922,PINK BUTTERFLY WASHBAG,5,2011-12,0
84929,ASSTD FRUIT+FLOWERS FRIDGE MAGNETS,65,2011-11,1
84944,SET OF 6 KASHMIR FOLKART BAUBLES,75,2011-11,1
84945,MULTI COLOUR SILVER T-LIGHT HOLDER,330,2011-12,0
84946,ANTIQUE SILVER T-LIGHT GLASS,564,2011-12,0
84946,ANTIQUE SILVER TEA GLASS ETCHED,152,2011-05,7
84947,ANTIQUE SILVER TEA GLASS ENGRAVED,302,2011-12,0
84949,SILVER HANGING T-LIGHT HOLDER,289,2011-12,0
84950,ASSORTED COLOUR T-LIGHT HOLDER,93,2011-12,0
84969,BOX OF 6 ASSORTED COLOUR TEASPOONS,75,2011-12,0
84974,S/2 ZINC HEART DESIGN PLANTERS,29,2011-11,1
84975,HEART SHAPED MIRROR,2,2010-12,12
84976,RECTANGULAR SHAPED MIRROR,31,2011-12,0
84978,HANGING HEART JAR T-LIGHT HOLDER,611,2011-12,0
84987,SET OF 36 TEATIME PAPER DOILIES,245,2011-12,0
84988,SET OF 72 PINK HEART PAPER DOILIES,311,2011-12,0
84990,60 GOLD AND SILVER FAIRY CAKE CASES,2,2011-05,7
84991,60 TEATIME FAIRY CAKE CASES,698,2011-12,0
84992,72 SWEETHEART FAIRY CAKE CASES,535,2011-12,0
85006,SET 4 NURSERY DES ROUND BOXES,9,2011-04,8
85008,SET OF 3 CONEY ISLAND OVAL BOXES,7,2011-04,8
85015,SET OF 12  VINTAGE POSTCARD SET,115,2011-12,0
85016,SET OF 6 VINTAGE NOTELETS KIT,25,2011-05,7
85020,ROUND PINK HEART MIRROR,16,2011-12,0
85030,FRENCH CHATEAU OVAL PLATTER,6,2011-04,8
85038,6 CHOCOLATE LOVE HEART T-LIGHTS,117,2011-12,0
85042,ANTIQUE LILY FAIRY LIGHTS,2,2011-01,11
85045,GREEN CHRISTMAS TREE STRING 20LIGHT,11,2011-11,1
85047,WHITE BEADED GARLAND STRING 20LIGHT,4,2011-01,11
85048,15CM CHRISTMAS GLASS BALL 20 LIGHTS,238,2011-12,0
85053,FRENCH ENAMEL CANDLEHOLDER,260,2011-12,0
85054,FRENCH ENAMEL POT W LID,93,2011-11,1
85055,FRENCH ENAMEL UTENSIL HOLDER,10,2011-01,11
85059,FRENCH ENAMEL WATER BASIN,82,2011-12,0
85062,PEARL CRYSTAL PUMPKIN T-LIGHT HLDR,137,2011-12,0
85063,CREAM SWEETHEART MAGAZINE RACK,2,2011-04,8
85064,CREAM SWEETHEART LETTER RACK,25,2011-04,8
85065,CREAM SWEETHEART TRAYS,1,2011-02,10
85066,CREAM SWEETHEART MINI CHEST,481,2011-12,0
85067,CREAM SWEETHEART WALL CABINET,5,2011-01,11
85068,CREAM SWEETHEART SHELF + HOOKS,1,2010-12,12
85078,SCANDINAVIAN 3 HEARTS NAPKIN RING,65,2011-10,2
85084,HOLLY TOP CHRISTMAS STOCKING,6,2010-12,12
85087,CANDY SPOT CUSHION COVER,8,2011-09,3
85088,CANDY SPOT HAND BAG,22,2011-11,1
85089,CANDY SPOT BUNNY,6,2011-11,1
85092,CANDY SPOT TEA COSY,2,2011-02,10
85093,CANDY SPOT EGG WARMER HARE,21,2011-11,1
85094,CANDY SPOT EGG WARMER RABBIT,31,2011-12,0
85095,THREE CANVAS LUGGAGE TAGS,10,2011-12,0
85096,HILDA CANDY SPOT RABBIT,12,2011-12,0
85103,SILVER T-LIGHT SETTING,7,2011-07,5
85104,SILVER GLASS T-LIGHT SET,15,2011-12,0
85106,CUT GLASS HEXAGON T-LIGHT HOLDER,10,2011-11,1
85107,CUT GLASS T-LIGHT HOLDER OCTAGON,29,2011-12,0
85109,PINK BOUDOIR T-LIGHT HOLDER,1,2010-12,12
85111,SILVER GLITTER FLOWER VOTIVE HOLDER,54,2011-12,0
85116,BLACK CANDELABRA T-LIGHT HOLDER,40,2011-10,2
85118,HEART T-LIGHT HOLDER,8,2011-01,11
85125,SMALL ROUND CUT GLASS CANDLESTICK,19,2011-11,1
85126,LARGE ROUND CUTGLASS CANDLESTICK,1,2011-01,11
85127,SMALL SQUARE CUT GLASS CANDLESTICK,21,2011-12,0
85141,JARDIN ETCHED GLASS FRUITBOWL,45,2011-06,6
85144,JARDIN ETCHED GLASS BUTTER DISH,1,2010-12,12
85144,JARDIN ETCHED GLASS CHEESE DISH,43,2011-05,7
85145,JARDIN ETCHED GLASS LARGE BELL JAR,14,2011-04,8
85146,JARDIN ETCHED GLASS SMALL BELL JAR,9,2011-04,8
85150,LADIES & GENTLEMEN METAL SIGN,373,2011-12,0
85152,HAND OVER THE CHOCOLATE   SIGN ,599,2011-12,0
85161,ACRYLIC GEOMETRIC LAMP,9,2011-11,1
85172,HYACINTH BULB T-LIGHT CANDLES,45,2011-12,0
85173,SET/6 FROG PRINCE T-LIGHT CANDLES,51,2011-12,0
85174,S/4 CACTI CANDLES,86,2011-12,0
85175,CACTI T-LIGHT CANDLES,135,2011-12,0
85176,SEWING SUSAN 21 NEEDLE SET,76,2011-12,0
85177,BASKET OF FLOWERS SEWING KIT,44,2011-12,0
85178,VICTORIAN SEWING KIT,105,2011-12,0
85187,S/12 MINI RABBIT EASTER,60,2011-11,1
85189,HANGING BUTTERFLY  EGG,4,2011-03,9
85195,HANGING HEART BASKET,3,2011-03,9
85197,SET OF 12 MINI BUNNIES IN A BUCKET,19,2011-07,5
85198,ASSORTED FARMYARD ANIMALS IN BUCKET,6,2011-05,7
85200,BUNNY EGG BOX,27,2011-04,8
85202,HANGING WOOD AND FELT HEART,49,2011-11,1
85203,HANGING WOOD AND FELT BUTTERFLY ,55,2011-12,0
85204,HANGING WOOD AND FELT FLOWER,45,2011-12,0
85208,SET/12 FUNKY FELT FLOWER PEG IN BAG,25,2011-11,1
85211,S/4 GROOVY CAT MAGNETS,20,2011-10,2
85212,MINI PAINTED GARDEN DECORATION ,73,2011-12,0
85213,MINI  ZINC GARDEN DECORATIONS ,26,2011-07,5
85214,TUB 24 PINK FLOWER PEGS,43,2011-08,4
85215,ASSORTED CHEESE FRIDGE MAGNETS,8,2011-08,4
85216,ASSORTED CAKES FRIDGE MAGNETS,8,2011-11,1
85224,ASSORTED COLOUR SILK GLASSES CASE,1,2011-03,9
85225,BLING KEY RING STAND,3,2011-12,0
85227,SET OF 6 3D KIT CARDS FOR KIDS,159,2011-12,0
90021,LASER CUT MULTI STRAND NECKLACE,1,2011-04,8
90022,EDWARDIAN DROP EARRINGS JET BLACK,5,2011-12,0
90023,FILIGREE DIAMANTE EARRINGS,4,2011-11,1
90028,NEW BAROQUE LARGE NECKLACE BLK/WHIT,1,2011-09,3
90029,NEW BAROQUE SMALL NECKLACE BLACK,2,2011-06,6
90031,BILI NUT AND WOOD NECKLACE,5,2011-11,1
90032,IVORY SHELL HEART NECKLACE,6,2011-10,2
90033,IVORY SHELL HEART EARRINGS,1,2011-05,7
90041,PEARL AND CHERRY QUARTZ BRACLET,1,2011-05,7
90043,COPPER AND BRASS BAG CHARM,2,2011-10,2
90046,WHITE WITH METAL BAG CHARM,1,2011-07,5
90048,GREEN WITH METAL BAG CHARM,1,2011-07,5
90049,IVORY GOLD METAL BAG CHARM,3,2011-11,1
90050,CRACKED GLAZE NECKLACE IVORY,3,2011-11,1
90051,CRACKED GLAZE NECKLACE RED,3,2011-10,2
90054,CRACKED GLAZE EARRINGS RED,1,2011-10,2
90055,CRACKED GLAZE EARRINGS BROWN,1,2011-02,10
90057,DIAMANTE RING ASSORTED IN BOX.,22,2011-12,0
90062,CARNIVAL BRACELET,7,2011-04,8
90069,RUBY GLASS CLUSTER NECKLACE,1,2011-11,1
90070,RUBY GLASS CLUSTER BRACELET,4,2011-11,1
90071,RUBY GLASS CLUSTER EARRINGS,1,2011-10,2
90072,RUBY DROP CHANDELIER EARRINGS,3,2011-09,3
90073,VINTAGE ENAMEL & CRYSTAL EARRINGS,4,2011-12,0
90074,BLACK DIAMOND CLUSTER NECKLACE,1,2011-09,3
90076,MONTANA DIAMOND CLUSTER EARRINGS,2,2011-05,7
90078,PINK/WHITE GLASS DEMI CHOKER,1,2010-12,12
90079,VINTAGE ENAMEL & CRYSTAL NECKLACE,2,2011-10,2
90083,CRYSTAL CZECH CROSS PHONE CHARM,4,2011-12,0
90084,PINK CRYSTAL GUITAR PHONE CHARM,1,2011-03,9
90085,CRYSTAL STILETTO PHONE CHARM,2,2011-12,0
90086,CRYSTAL FROG PHONE CHARM,11,2011-12,0
90087,CRYSTAL SEA HORSE PHONE CHARM,8,2011-12,0
90089,PINK CRYSTAL SKULL PHONE CHARM,3,2011-12,0
90093,CLEAR CRYSTAL STAR PHONE CHARM,6,2011-12,0
90094,NECKLACE+BRACELET SET FRUIT SALAD ,12,2011-12,0
90096,NECKLACE+BRACELET SET BLUE BLOSSOM,3,2011-11,1
90098,NECKLACE+BRACELET PINK BUTTERFLY,10,2011-11,1
90099,NECKLACE+BRACELET SET BLUE HIBISCUS,13,2011-12,0
90100,NECKLACE+BRACELET SET PINK DAISY,1,2011-02,10
90101,WHITE FRANGIPANI NECKLACE,5,2011-11,1
90102,WHITE FRANGIPANI HAIR CLIP,1,2011-06,6
90103,PURPLE FRANGIPANI NECKLACE,2,2011-11,1
90104,PURPLE FRANGIPANI HAIRCLIP,1,2010-12,12
90108,BLUE BLOSSOM HAIR CLIP,7,2011-10,2
90114,SUMMER DAISIES BAG CHARM,11,2011-12,0
90116,FRUIT SALAD BAG CHARM,3,2011-12,0
90118,PINK DAISY BAG CHARM,2,2011-10,2
90119,METALIC LEAVES BAG CHARMS,16,2011-12,0
90131,PINK/AMETHYST/GOLD NECKLACE,1,2011-03,9
90133,TEAL/FUSCHIA COL BEAD NECKLACE,3,2011-11,1
90135,ORANGE/WHT/FUSCHIA STONES NECKLACE,1,2011-04,8
90136,PALE PINK/AMETHYST STONE NECKLACE,2,2011-04,8
90138,WHITE/PINK MINI CRYSTALS NECKLACE,1,2011-04,8
90143,SILVER BRACELET W PASTEL FLOWER,10,2011-09,3
90144,SILVER DROP EARRINGS WITH FLOWER,3,2011-06,6
90145,SILVER HOOP EARRINGS WITH FLOWER,11,2011-11,1
90146,FINE SILVER NECKLACE W PASTEL FLOWE,3,2011-10,2
90147,CHUNKY SILVER NECKLACE PASTEL FLOWE,13,2011-11,1
90148,LONG SILVER NECKLACE PASTEL FLOWER,8,2011-09,3
90149,SILVER FLOWR PINK SHELL NECKLACE,3,2011-09,3
90151,SILVER/NATURAL SHELL NECKLACE,4,2011-11,1
90154,LAZER CUT NECKLACE W PASTEL BEADS,5,2011-11,1
90155,RESIN NECKLACE W PASTEL BEADS,4,2011-11,1
90156,RESIN BRACELET W PASTEL BEADS,2,2011-09,3
90157,RIVIERA NECKLACE,2,2011-11,1
90158,ST TROPEZ NECKLACE,6,2011-11,1
90159,COTE D'AZURE NECKLACE,2,2011-11,1
90166,PINK & WHITE ROSEBUD RING,8,2011-11,1
90167,BEADED LOVE HEART JEWELLERY SET,1,2010-12,12
90168,2 DAISIES HAIR COMB,2,2011-10,2
90169,DAISY HAIR COMB,2,2011-10,2
90170,DAISY HAIR BAND,7,2011-11,1
90173,PAIR BUTTERFLY HAIR CLIPS,3,2011-05,7
90174,BUTTERFLY HAIR BAND,6,2011-10,2
90188,DROP EARRINGS W FLOWER & LEAF,3,2011-11,1
90191,SILVER LARIAT 40CM,7,2011-11,1
90192,JADE DROP EARRINGS W FILIGREE,9,2011-12,0
90194,SILVER LARIAT BLACK STONE EARRINGS,6,2011-10,2
90204,PAIR OF ENAMEL BUTTERFLY HAIRCLIP,9,2011-11,1
90208,PAIR OF PINK FLOWER CLUSTER SLIDE,5,2011-11,1
10123C,HEARTS WRAPPING TAPE ,3,2011-03,9
10124A,SPOTS ON RED BOOKCOVER TAPE,5,2011-11,1
10124G,ARMY CAMO BOOKCOVER TAPE,4,2011-11,1
15044A,PINK PAPER PARASOL ,80,2011-12,0
15044B,BLUE PAPER PARASOL ,49,2011-09,3
15044C,PURPLE PAPER PARASOL,63,2011-12,0
15044D,RED PAPER PARASOL,76,2011-12,0
15056BL,EDWARDIAN PARASOL BLACK,296,2011-12,0
15056N,EDWARDIAN PARASOL NATURAL,388,2011-12,0
15056P,EDWARDIAN PARASOL PINK,141,2011-12,0
15058A,BLUE POLKADOT GARDEN PARASOL,55,2011-11,1
15058B,PINK POLKADOT GARDEN PARASOL,43,2011-11,1
15058C,ICE CREAM DESIGN GARDEN PARASOL,30,2011-09,3
15060B,FAIRY CAKE DESIGN UMBRELLA,96,2011-11,1
16020C,CLEAR STATIONERY BOX SET ,2,2011-04,8
16151A,FLOWERS HANDBAG blue and orange,3,2011-05,7
16156L,WRAP CAROUSEL,14,2011-12,0
16156L,"WRAP, CAROUSEL",4,2011-03,9
16156S,WRAP PINK FAIRY CAKES ,167,2011-12,0
16161G,WRAP BAD HAIR DAY,22,2011-11,1
16161M,WRAP  PINK FLOCK,1,2010-12,12
16161P,WRAP ENGLISH ROSE ,250,2011-12,0
16161U,WRAP SUKI AND FRIENDS,135,2011-12,0
16162L,THE KING GIFT BAG,6,2011-09,3
16162M,THE KING GIFT BAG 25x24x12cm,7,2011-11,1
16168M,FUNKY MONKEY GIFT BAG MEDIUM,20,2011-12,0
16169E,WRAP 50'S  CHRISTMAS,152,2011-12,0
16169K,WRAP FOLK ART,8,2011-09,3
16169M,WRAP DAISY CARPET ,26,2011-12,0
16169N,WRAP BLUE RUSSIAN FOLKART,1,2010-12,12
16169P,WRAP GREEN RUSSIAN FOLKART ,2,2010-12,12
16202A,PASTEL PINK PHOTO ALBUM ,2,2011-04,8
16202B,PASTEL BLUE PHOTO ALBUM ,2,2011-04,8
16202E,BLACK PHOTO ALBUM ,4,2011-04,8
16206B,RED PURSE WITH PINK HEART,2,2011-01,11
16207A,PINK STRAWBERRY HANDBAG ,5,2011-11,1
16207B,PINK HEART RED HANDBAG,3,2011-08,4
16244B,MAXWELL 2 TONE BLUE 60 PAGE PHOTO A,2,2011-05,7
16248B,BLUE HOLE PUNCH,7,2011-10,2
16258A,SWIRLY CIRCULAR RUBBERS IN BAG,39,2011-12,0
17007B,S/3 POT POURI CUSHIONS BLUE COLOURS,2,2011-06,6
17011F,ORIGAMI SANDLEWOOD INCENSE+FLOWER,6,2011-05,7
17012A,ORIGAMI VANILLA INCENSE/CANDLE SET ,25,2011-12,0
17012B,ORIGAMI JASMINE INCENSE/CANDLE SET,36,2011-11,1
17012C,ORIGAMI LAVENDER INCENSE/CANDL SET ,44,2011-12,0
17012D,ORIGAMI ROSE INCENSE/CANDLE SET ,46,2011-12,0
17012E,ORIGAMI OPIUM INCENSE/CANDLE SET ,4,2010-12,12
17012F,ORIGAMI SANDLEWOOD INCENSE/CAND SET,42,2011-12,0
17013D,ORIGAMI ROSE INCENSE IN TUBE,11,2011-06,6
17014A,ORIGAMI VANILLA INCENSE CONES,7,2011-06,6
17028J,INCENSE BAZAAR PEACH,1,2011-01,11
17084A,TRANQUILITY MASALA INCENSE,7,2011-09,3
17084J,LOVE POTION MASALA INCENSE,8,2011-09,3
17084N,FAIRY DREAMS INCENSE ,32,2011-12,0
17084P,DRAGONS BLOOD INCENSE,13,2011-11,1
17084R,ASSORTED INCENSE PACK,27,2011-12,0
17090A,LAVENDER INCENSE 40 CONES IN TIN,10,2011-11,1
17090D,VANILLA INCENSE 40 CONES IN TIN,13,2011-07,5
17091A,LAVENDER INCENSE IN TIN,26,2011-05,7
17091J,VANILLA INCENSE IN TIN,91,2011-12,0
17107D,FLOWER FAIRY 5 DRAWER LINERS,21,2011-12,0
17107D,FLOWER FAIRY 5 SUMMER DRAW LINERS,1,2011-09,3
17107D,"FLOWER FAIRY,5 SUMMER B'DRAW LINERS",25,2011-06,6
17109D,FLOWER FAIRY INCENSE BOUQUET,5,2011-04,8
17129F,BLUE GLASS GEMS IN BAG,20,2011-11,1
17136A,BLUE STONES ON WIRE FOR CANDLE,20,2011-11,1
17164B,ASS COL SMALL SAND GECKO P'WEIGHT,10,2011-01,11
17165D,ASS COL LARGE SAND FROG P'WEIGHT,7,2011-01,11
17191A,ROSE FLOWER CANDLE+INCENSE 16X16CM,2,2011-12,0
18094C,WHITE AND BLUE CERAMIC OIL BURNER,15,2011-10,2
18097A,PINK TALL PORCELAIN T-LIGHT HOLDER ,4,2011-06,6
18097C,WHITE TALL PORCELAIN T-LIGHT HOLDER,58,2011-11,1
18098C,PORCELAIN BUTTERFLY OIL BURNER,38,2011-08,4
35001G,HAND OPEN SHAPE GOLD,27,2011-12,0
35001W,HAND OPEN SHAPE DECO.WHITE,6,2010-12,12
35004B,SET OF 3 BLACK FLYING DUCKS,57,2011-12,0
35004C,SET OF 3 COLOURED  FLYING DUCKS,46,2011-03,9
35004G,SET OF 3 GOLD FLYING DUCKS,21,2011-12,0
35004P,SET OF 3 PINK FLYING DUCKS,1,2010-12,12
35095A,BLUE VICTORIAN FABRIC OVAL BOX,34,2011-12,0
35095B,RED VICTORIAN FABRIC OVAL BOX,41,2011-12,0
35271S,GOLD PRINT PAPER BAG,2,2010-12,12
35471D,SET OF 3 BIRD LIGHT PINK FEATHER ,150,2011-12,0
35591T,TURQUOISE CHRISTMAS TREE ,4,2011-11,1
35597A,DUSTY PINK CHRISTMAS TREE 30CM,1,2010-12,12
35597B,BLACKCHRISTMAS TREE 30CM,1,2010-12,12
35597D,PINK/WHITE CHRISTMAS TREE 30CM,2,2011-09,3
35598A,DUSTY PINK CHRISTMAS TREE 60CM,2,2011-11,1
35598B,BLACK CHRISTMAS TREE 60CM,22,2011-11,1
35598C,WHITE CHRISTMAS TREE 60CM,2,2011-11,1
35598D,PINK/WHITE CHRISTMAS TREE 60CM,25,2011-12,0
35599B,BLACK CHRISTMAS TREE 120CM,23,2011-12,0
35599D,PINK AND WHITE CHRISTMAS TREE 120CM,19,2011-12,0
35607A,PINK FLUFFY CHRISTMAS DECORATION,1,2010-12,12
35607B,BLACK FEATHER CHRISTMAS DECORATION,7,2011-09,3
35610A,PINK CHRISTMAS FLOCK DROPLET ,1,2010-12,12
35610B,BLACK CHRISTMAS FLOCK DROPLET ,1,2010-12,12
35610C,WHITE CHRISTMAS FLOCK DROPLET ,1,2010-12,12
35637A,IVORY STRING CURTAIN WITH POLE ,24,2011-11,1
35637C,PINK STRING CURTAIN WITH POLE,7,2011-11,1
35638A,PINK AND BLACK STRING CURTAIN,5,2011-11,1
35638B,PINK/BLUE STRING CURTAIN ,4,2011-11,1
35809A,ENAMEL PINK TEA CONTAINER,42,2011-06,6
35809B,ENAMEL BLUE RIM TEA CONTAINER,3,2011-04,8
35810A,ENAMEL PINK COFFEE CONTAINER,54,2011-10,2
35810B,ENAMEL BLUE RIM COFFEE CONTAINER,23,2011-11,1
35815P,"ACRYLIC JEWEL SNOWFLAKE, PINK",5,2011-09,3
35816P,"ACRYLIC JEWEL ANGEL,PINK",2,2011-08,4
35817P,"ACRYLIC JEWEL SNOWFLAKE,PINK",1,2010-12,12
35817P,PINK ACRYLIC JEWEL SNOWFLAKE,1,2011-08,4
35818B,"ACRYLIC JEWEL ICICLE, BLUE",3,2011-11,1
35818P,"ACRYLIC JEWEL ICICLE, PINK",18,2011-12,0
35819B,"ACRYLIC HANGING JEWEL,BLUE",27,2011-11,1
35819P,"ACRYLIC HANGING JEWEL,PINK",7,2011-11,1
35833P,4 PINK FLOCK CHRISTMAS BALLS,12,2011-11,1
35909A,RABBIT EASTER DECORATION,3,2011-04,8
35909B,PINK FLOWERS RABBIT EASTER,2,2011-06,6
35910A,MULTICOLOUR EASTER RABBIT ,4,2011-03,9
35910B,PINK FLOWERS RABBIT EASTER,3,2011-11,1
35911A,MULTICOLOUR RABBIT EGG WARMER,25,2011-11,1
35911B,PINK/FLOWER RABBIT EGG WARMER ,4,2011-02,10
35912B,WHITE/PINK CHICK DECORATION,18,2011-10,2
35913B,WHITE/PINK CHICK EASTER DECORATION,10,2011-11,1
35915B,BLUE KNITTED HEN ,14,2011-03,9
35915C,PEACH KNITTED HEN ,8,2011-04,8
35916A,YELLOW FELT HANGING HEART W FLOWER,3,2011-08,4
35916B,BLUE FELT HANGING HEART WITH FLOWER,1,2011-08,4
35916C,PINK FELT HANGING HEART W FLOWER,5,2011-08,4
37379A,PINK CHERRY BLOSSOM CUP & SAUCER,1,2011-01,11
37444A,YELLOW BREAKFAST CUP AND SAUCER,16,2011-07,5
37444B,BLUE BREAKFAST CUP AND SAUCER ,3,2011-03,9
37444C,PINK BREAKFAST CUP AND SAUCER ,9,2011-03,9
37462E,"PET MUG, GOLDFISH",4,2011-11,1
37479B,CUBIC MUG FLOCK BLUE ON BROWN,17,2011-06,6
37479P,CUBIC MUG FLOCK PINK ON BROWN,23,2011-11,1
37482P,CUBIC MUG PINK POLKADOT,37,2011-04,8
37487B,YELLOW/ORANGE FLOWER DESIGN PLATE,2,2011-04,8
37488A,YELLOW PINK FLOWER DESIGN BIG BOWL,3,2011-04,8
37489A,YELLOW/PINK FLOWER DESIGN BIG MUG,15,2011-11,1
37489B,BLUE/YELLOW FLOWER DESIGN BIG MUG,12,2011-11,1
37489C,GREEN/BLUE FLOWER DESIGN BIG MUG,8,2011-09,3
37489D,PINK/GREEN FLOWER DESIGN BIG MUG,17,2011-12,0
37491B,BLUE/YELLOW CERAMIC CANDLE HOLDER,1,2011-07,5
37491C,GREEN/BLUE CERAMIC CANDLE HOLDER,1,2011-07,5
37491D,PURPLE/BLUE CERAMIC CANDLE HOLDER,1,2011-07,5
40005B,BLUE ORGANDY ROUND LAMPSHADE W BEA,4,2011-11,1
40046A,RED DAISY PAPER LAMPSHADE,6,2011-10,2
44089A,PINK GAUZE BUTTERFLY LAMPSHADE,4,2011-11,1
44089C,LILAC GAUZE BUTTERFLY LAMPSHADE,6,2011-09,3
44091A,BLUE CRUSOE CHECK LAMPSHADE,3,2011-07,5
44092B,BLUE WHITE PLASTIC RINGS LAMPSHADE,5,2011-09,3
44092C,PURPLE/COPPER HANGING LAMPSHADE,8,2011-10,2
44242A,LILAC FEATHERS CURTAIN,1,2011-07,5
44242B,PINK FEATHERS CURTAIN,3,2011-09,3
46000M,POLYESTER FILLER PAD 45x45cm,135,2011-12,0
46000P,POLYESTER FILLER PAD 65CMx65CM,5,2011-09,3
46000R,POLYESTER FILLER PAD 45x30cm,37,2011-12,0
46000S,POLYESTER FILLER PAD 40x40cm,185,2011-12,0
46000U,POLYESTER FILLER PAD 30CMx30CM,26,2011-12,0
46115B,GREEN POP ART MAO CUSHION COVER ,2,2011-03,9
46126A,ELVIS WALLHANGING / CURTAIN,6,2011-05,7
46138B,BLUE CHENILLE SHAGGY CUSHION COVER ,14,2011-11,1
46775D,SUNSET COLOUR CHUNKY KNITTED THROW,13,2011-12,0
46776A,WOVEN BUBBLE GUM CUSHION COVER,6,2011-11,1
46776B,WOVEN BERRIES CUSHION COVER ,7,2011-12,0
46776C,WOVEN FROST CUSHION COVER,6,2011-12,0
46776D,WOVEN SUNSET CUSHION COVER ,3,2011-09,3
46776E,WOVEN CANDY CUSHION COVER ,5,2011-11,1
46776F,WOVEN ROSE GARDEN CUSHION COVER ,8,2011-12,0
47013A,WINE BOTTLE DRESSING LT.BLUE,4,2011-04,8
47013C,WINE BOTTLE DRESSING DARK BLUE,8,2011-06,6
47021G,SET/6 BEAD COASTERS GAUZE BAG GOLD,15,2011-06,6
47310M,SMALL POP BOX FUNKY MONKEY,35,2011-12,0
47310M,"SMALL POP BOX,FUNKY MONKEY",13,2011-05,7
47341A,FUSCHIA TABLE RUN FLOWER ,5,2011-06,6
47341B,BLUE TABLE RUN FLOWER,11,2011-11,1
47343A,FUSCHIA FLOWER PURSE WITH BEADS,14,2011-08,4
47344B,BLUE FLOWER DES PURSE,6,2011-06,6
47348A,FUSCHIA VOILE POINTY SHOE DEC,15,2011-09,3
47351B,BLUE  VOILE LAMPSHADE,10,2011-11,1
47367B,PAIR PADDED HANGERS PINK CHECK,11,2011-10,2
47369A,PINK GREEN EMBROIDERY COSMETIC BAG,6,2011-11,1
47369B,BLUE GREEN EMBROIDERY COSMETIC BAG,3,2011-11,1
47503A,ASS FLORAL PRINT MULTI SCREWDRIVER,170,2011-11,1
47503H,ASS FLORAL PRINT SPIRIT LEVEL ,36,2011-12,0
47503J,SET/3 FLORAL GARDEN TOOLS IN BAG,1,2010-12,12
47504H,ENGLISH ROSE SPIRIT LEVEL ,93,2011-12,0
47504K,ENGLISH ROSE GARDEN SECATEURS,180,2011-11,1
47518F,ICON PLACEMAT POP ART ELVIS,28,2011-11,1
47556B,TEA TIME TEA TOWELS ,2,2011-04,8
47559B,TEA TIME OVEN GLOVE,248,2011-12,0
47563A,RETRO LONGBOARD IRONING BOARD COVER,47,2011-12,0
47566B,TEA TIME PARTY BUNTING,324,2011-12,0
47567B,TEA TIME KITCHEN APRON,133,2011-12,0
47570B,TEA TIME TABLE CLOTH,26,2011-03,9
47574A,ENGLISH ROSE SCENTED HANGING FLOWER,53,2011-10,2
47574B,ENGLISH ROSE SCENTED HANGING HEART,2,2011-05,7
47578A,ENGLISH ROSE SMALL SCENTED FLOWER,31,2011-12,0
47585A,PINK FAIRY CAKE CUSHION COVER,27,2011-12,0
47586A,PINK FAIRY CAKE CUSHION COVER,8,2011-11,1
47590A,BLUE HAPPY BIRTHDAY BUNTING,359,2011-12,0
47590B,PINK HAPPY BIRTHDAY BUNTING,367,2011-12,0
47591B,SCOTTIES CHILDRENS APRON,10,2011-01,11
47591D,PINK FAIRY CAKE CHILDRENS APRON,403,2011-12,0
47593A,CAROUSEL PONIES BABY BIB,13,2011-03,9
47593B,SCOTTIE DOGS BABY BIB,96,2011-12,0
47594A,CAROUSEL DESIGN WASHBAG,31,2011-11,1
47594B,SCOTTIES DESIGN WASHBAG,33,2011-11,1
47599A,PINK PARTY BAGS,147,2011-12,0
47599B,BLUE PARTY BAGS ,110,2011-12,0
48173C,DOORMAT BLACK FLOCK ,178,2011-12,0
51014A,"FEATHER PEN,HOT PINK",162,2011-12,0
51014C,"FEATHER PEN,COAL BLACK",118,2011-12,0
51014L,"FEATHER PEN,LIGHT PINK",109,2011-12,0
51020A,SUMMER FUN DESIGN SHOWER CAP,19,2011-04,8
51020B,STRIPY DESIGN SHOWER CAP,16,2011-04,8
62043B,BLUE CHECK BAG W HANDLE 34X20CM,6,2011-05,7
62074B,ELEPHANT CLIP W SUCTION CUP,4,2011-07,5
62086A,PINK RETRO BIG FLOWER BAG,13,2011-06,6
62094B,TURQ ICE CREAM BUM BAG ,3,2011-01,11
62096A,PINK/YELLOW FLOWERS HANDBAG,8,2011-02,10
62096B,PURPLE/TURQ FLOWERS HANDBAG,1,2011-03,9
62097B,BLUE STRIPES SHOULDER BAG,3,2011-05,7
71101E,STANDING FAIRY POLE SUPPORT ,23,2011-11,1
71406C,BLACK ORANGE SQUEEZER,21,2011-11,1
71495A,CD WALL TIDY BLUE OFFICE,2,2011-11,1
71495B,CD WALL TIDY RED FLOWERS,5,2011-11,1
71496A,A4 WALL TIDY BLUE OFFICE,5,2011-11,1
71496B,A4 WALL TIDY RED FLOWERS,4,2011-11,1
72024U,LILAC VOTIVE CANDLE,3,2011-06,6
72051S,BAG OF SILVER STONES,6,2011-04,8
72140E,BEST DAD CANDLE LETTERS,9,2011-10,2
72225C,LAVENDER SCENT CAKE CANDLE,16,2011-11,1
72349B,SET/6 PURPLE BUTTERFLY T-LIGHTS,95,2011-12,0
72351A,SET/6 TURQUOISE BUTTERFLY T-LIGHTS,139,2011-12,0
72351B,SET/6 PINK  BUTTERFLY T-LIGHTS,162,2011-12,0
72369A,PINK CLEAR GLASS CANDLE PLATE,4,2011-11,1
72760B,VINTAGE CREAM 3 BASKET CAKE STAND,138,2011-12,0
72798C,SET/4 GARDEN ROSE DINNER CANDLE,3,2011-02,10
72799C,PINK PILLAR CANDLE SILVER FLOCK,18,2011-12,0
72799E,IVORY PILLAR CANDLE SILVER FLOCK,51,2011-12,0
72799F,IVORY PILLAR CANDLE GOLD FLOCK,22,2011-11,1
72800B, 4 PURPLE FLOCK DINNER CANDLES,39,2011-12,0
72800C,4 PINK DINNER CANDLE SILVER FLOCK,32,2011-12,0
72800D,4 BLUE DINNER CANDLES SILVER FLOCK,30,2011-11,1
72800E,4 IVORY DINNER CANDLES SILVER FLOCK,102,2011-12,0
72801C,4 ROSE PINK DINNER CANDLES,14,2011-12,0
72801D,4 SKY BLUE DINNER CANDLES,12,2011-12,0
72801G,4 BURGUNDY WINE DINNER CANDLES,12,2011-11,1
72802A,ROSE SCENT CANDLE IN JEWELLED BOX,61,2011-12,0
72802B,OCEAN SCENT CANDLE IN JEWELLED BOX,80,2011-11,1
72802C,VANILLA SCENT CANDLE JEWELLED BOX,95,2011-11,1
72803A,ROSE SCENT CANDLE JEWELLED DRAWER,43,2011-11,1
72807A,SET/3 ROSE CANDLE IN JEWELLED BOX,73,2011-11,1
72807B,SET/3 OCEAN SCENT CANDLE JEWEL BOX,83,2011-11,1
72807C,SET/3 VANILLA SCENTED CANDLE IN BOX,122,2011-12,0
75013B,"STRING OF 8 BUTTERFLIES,PINK",7,2011-01,11
75049L,LARGE CIRCULAR MIRROR MOBILE,144,2011-12,0
77101A,UNION FLAG WINDSOCK,21,2011-03,9
78034B,BLUE NETTING STORAGE HANGER,7,2011-10,2
79026B,"S/4 ICON COASTER,ELVIS LIVES",9,2011-05,7
79030D,TUMBLER BAROQUE,27,2011-11,1
79030D,"TUMBLER, BAROQUE",5,2011-04,8
79030G,TUMBLER NEW ENGLAND,42,2011-06,6
79030G,"TUMBLER, NEW ENGLAND",11,2011-04,8
79051A,SMOKEY GREY COLOUR D.O.F. GLASS,28,2011-08,4
79051A,SMOKEY GREY COLOUR GLASS,12,2011-12,0
79062D,"RETRO TIN ASHTRAY,REVOLUTIONARY",4,2011-08,4
79063C,"RETRO PILL BOX KEY CHAIN,THE KING",14,2011-12,0
79063D,"RETRO PILL BOX , REVOLUTIONARY",11,2011-11,1
79066K,RETRO MOD TRAY,113,2011-12,0
79071B,ENGLISH ROSE METAL WASTE BIN,11,2011-06,6
79144B,PAINTED LIGHTBULB STAR+ MOON,16,2011-11,1
79144C,PAINTED LIGHTBULB RAINBOW DESIGN,7,2011-10,2
79149B,SILICON STAR BULB  BLUE,8,2011-12,0
79151B,"SILICON CUBE 25W, BLUE",2,2011-11,1
79157B,UBO-LIGHT TRIOBASE BLUE,2,2011-12,0
79157V,UBO-LIGHT TRIOBASE PURPLE,3,2011-11,1
79161A,ST GEORGE SET OF 10 PARTY LIGHTS,2,2011-11,1
79190A,RETRO PLASTIC 70'S TRAY,35,2011-12,0
79190B,RETRO PLASTIC POLKA TRAY,37,2011-12,0
79190D,RETRO PLASTIC DAISY TRAY,25,2011-12,0
79191B,RETRO PLASTIC POLKA TRAY,27,2011-12,0
79191C,RETRO PLASTIC ELEPHANT TRAY,78,2011-12,0
79191D,RETRO PLASTIC DAISY TRAY,8,2011-12,0
79192A,RETRO PLASTIC 70'S TRAY,2,2011-02,10
79302M,"ART LIGHTS,FUNK MONKEY",48,2011-12,0
79323B,BLACK CHERRY LIGHTS,3,2011-02,10
79323P,PINK CHERRY LIGHTS,3,2011-02,10
79323W,WHITE CHERRY LIGHTS,1,2011-01,11
81950B,FLOWER BLUE CLOCK WITH SUCKER,10,2011-08,4
81950V,FLOWER PURPLE CLOCK W/SUCKER,3,2011-03,9
81950V,FLOWER PURPLE CLOCK WITH SUCKER,4,2011-07,5
81952B,ROUND BLUE CLOCK WITH SUCKER,9,2011-07,5
81952V,ROUND PURPLE CLOCK WITH SUCKER,27,2011-11,1
81953B,ROUND BLUE CLOCK WITH SUCKER,5,2011-07,5
81953P,ROUND ARTICULATED PINK CLOCK W/SUCK,3,2011-07,5
82001S,SILVER RECORD COVER FRAME,19,2011-12,0
