StockCode,ProductName,Count,LatestMonth,UnsoldDuration
10002,INFLATABLE POLITICAL GLOBE ,49,2011-04,8
10080,GROOVY CACTUS INFLATABLE,21,2011-11,1
10120,DOGGY RUBBER,30,2011-12,0
10125,MINI FUNKY DESIGN TAPES,64,2011-12,0
10133,COLOURING PENCILS BROWN TUBE,125,2011-09,3
10135,COLOURING PENCILS BROWN TUBE,122,2011-12,0
11001,ASSTD DESIGN RACING CAR PEN,69,2011-12,0
15030,FAN BLACK FRAME ,13,2011-12,0
15034,PAPER POCKET TRAVELING FAN ,95,2011-11,1
15036,ASSORTED COLOURS SILK FAN,329,2011-12,0
15039,SANDALWOOD FAN,74,2011-12,0
16008,SMALL FOLDING SCISSOR(POINTED EDGE),70,2011-12,0
16010,FOLDING CAMPING SCISSOR W/KNIF & S,3,2011-03,9
16011,ANIMAL STICKERS,47,2011-12,0
16012,FOOD/DRINK SPONGE STICKERS,37,2011-12,0
16014,SMALL CHINESE STYLE SCISSOR,54,2011-12,0
16015,MEDIUM CHINESE STYLE SCISSOR,24,2011-11,1
16016,LARGE CHINESE STYLE SCISSOR,65,2011-12,0
16033,MINI HIGHLIGHTER PENS,4,2011-02,10
16043,POP ART PUSH DOWN RUBBER ,2,2011-06,6
16045,POPART WOODEN PENCILS ASST,69,2011-12,0
16046,TEATIME PEN CASE & PENS,16,2011-11,1
16048,TEATIME ROUND PENCIL SHARPENER ,49,2011-11,1
16049,TEATIME GEL PENS ASST,5,2011-05,7
16052,TEATIME PUSH DOWN RUBBER,6,2011-06,6
16054,POPART RECT PENCIL SHARPENER ASST,34,2011-12,0
16216,LETTER SHAPE PENCIL SHARPENER,41,2011-12,0
16218,CARTOON  PENCIL SHARPENERS,50,2011-12,0
16219,HOUSE SHAPE PENCIL SHARPENER,48,2011-12,0
16225,RATTLE SNAKE EGGS,77,2011-12,0
16235,RECYCLED PENCIL WITH RABBIT ERASER,82,2011-12,0
16236,KITTY PENCIL ERASERS,73,2011-12,0
16237,SLEEPING CAT ERASERS,170,2011-12,0
16238,PARTY TIME PENCIL ERASERS,80,2011-12,0
16254,TRANSPARENT ACRYLIC TAPE DISPENSER,9,2011-11,1
16259,PIECE OF CAMO STATIONERY SET,32,2011-11,1
17001,HEAVENS SCENT FRAGRANCE OILS ASSTD,1,2011-02,10
17003,BROCADE RING PURSE ,212,2011-12,0
17021,NAMASTE SWAGAT INCENSE,57,2011-12,0
17038,PORCELAIN BUDAH INCENSE HOLDER,19,2011-11,1
17096,ASSORTED LAQUERED INCENSE HOLDERS,13,2011-07,5
17174,ASSTD RASTA KEY-CHAINS,3,2011-11,1
18007,ESSENTIAL BALM 3.5g TIN IN ENVELOPE,18,2011-07,5
20615,BLUE POLKADOT PASSPORT COVER,35,2011-12,0
20616,CHERRY BLOSSOM PASSPORT COVER,25,2011-12,0
20617,FIRST CLASS PASSPORT COVER ,26,2011-11,1
20618,QUEEN OF THE SKIES PASSPORT COVER ,28,2011-12,0
20619,TROPICAL PASSPORT COVER ,22,2011-11,1
20622,VIP PASSPORT COVER ,11,2011-11,1
20622,VIPPASSPORT COVER ,22,2011-06,6
20652,BLUE POLKADOT LUGGAGE TAG ,36,2011-12,0
20653,CHERRY BLOSSOM LUGGAGE TAG,6,2011-12,0
20654,FIRST CLASS LUGGAGE TAG ,24,2011-12,0
20655,QUEEN OF SKIES LUGGAGE TAG,34,2011-12,0
20657,TROPICAL LUGGAGE TAG,22,2011-11,1
20658,RED RETROSPOT LUGGAGE TAG,62,2011-09,3
20659,ECONOMY LUGGAGE TAG,32,2011-12,0
20661,BLUE POLKADOT PURSE ,5,2011-10,2
20662,FIRST CLASS HOLIDAY PURSE ,5,2011-10,2
20663,QUEEN OF THE SKIES HOLIDAY PURSE ,3,2011-10,2
20664,TROPICAL HOLIDAY PURSE ,3,2010-12,12
20665,RED RETROSPOT PURSE ,73,2011-10,2
20666,ECONOMY HOLIDAY PURSE,4,2011-04,8
20667,CHERRY BLOSSOM PURSE,1,2011-05,7
20668,DISCO BALL CHRISTMAS DECORATION,188,2011-12,0
20669,RED HEART LUGGAGE TAG,47,2011-11,1
20670,VIP HOLIDAY PURSE,6,2011-11,1
20671,BLUE TEATIME PRINT BOWL ,2,2010-12,12
20674,GREEN POLKADOT BOWL,153,2011-12,0
20675,BLUE POLKADOT BOWL,228,2011-12,0
20676,RED RETROSPOT BOWL,307,2011-12,0
20677,PINK POLKADOT BOWL,225,2011-12,0
20678,LARGE BLACK DIAMANTE HAIRSLIDE,1,2011-09,3
20679,EDWARDIAN PARASOL RED,274,2011-12,0
20681,PINK POLKADOT CHILDRENS UMBRELLA,36,2011-04,8
20682,RED RETROSPOT CHILDRENS UMBRELLA,189,2011-12,0
20684,STRAWBERRY DREAM CHILDS UMBRELLA,33,2011-07,5
20685,DOORMAT RED RETROSPOT,586,2011-12,0
20686,DOLLY MIXTURE CHILDREN'S UMBRELLA,65,2011-12,0
20694,FLORAL PINK MONSTER,11,2011-10,2
20695,FLORAL BLUE MONSTER,4,2011-11,1
20696,FLORAL SOFT CAR TOY,10,2011-11,1
20697,LITTLE GREEN MONSTER SOFT TOY,11,2011-11,1
20698,LITTLE PINK MONSTER SOFT TOY,8,2011-11,1
20699,MOUSEY LONG LEGS SOFT TOY,11,2011-12,0
20700,GREEN CAT FLORAL CUSHION COVER ,4,2011-06,6
20701,PINK CAT FLORAL CUSHION COVER ,3,2011-06,6
20702,PINK PADDED MOBILE,41,2011-10,2
20703,BLUE PADDED SOFT MOBILE,4,2011-06,6
20704,MR ROBOT SOFT TOY,40,2011-12,0
20705,MRS ROBOT SOFT TOY,29,2011-12,0
20707,CRAZY DAISY HEART DECORATION,32,2011-12,0
20711,JUMBO BAG TOYS ,254,2011-11,1
20712,JUMBO BAG WOODLAND ANIMALS,506,2011-12,0
20713,JUMBO BAG OWLS,427,2011-12,0
20716,PARTY FOOD SHOPPER BAG,35,2011-06,6
20717,STRAWBERRY SHOPPER BAG,237,2011-12,0
20718,RED RETROSPOT SHOPPER BAG,394,2011-12,0
20719,WOODLAND CHARLOTTE BAG,554,2011-12,0
20723,STRAWBERRY CHARLOTTE BAG,512,2011-12,0
20724,RED RETROSPOT CHARLOTTE BAG,767,2011-12,0
20725,LUNCH BAG RED RETROSPOT,1358,2011-12,0
20725,LUNCH BAG RED SPOTTY,1,2011-01,11
20726,LUNCH BAG WOODLAND,861,2011-12,0
20727,LUNCH BAG  BLACK SKULL.,1126,2011-12,0
20728,LUNCH BAG CARS BLUE,1012,2011-12,0
20731,POSY CANDY BAG,8,2011-06,6
20733,GOLD MINI TAPE MEASURE ,50,2011-12,0
20735,BLACK MINI TAPE MEASURE ,30,2011-12,0
20748,KENSINGTON COFFEE SET,30,2011-11,1
20749,ASSORTED COLOUR MINI CASES,374,2011-12,0
20750,RED RETROSPOT MINI CASES,371,2011-12,0
20751,FUNKY WASHING UP GLOVES ASSORTED,198,2011-12,0
20752,BLUE POLKADOT WASHING UP GLOVES,119,2011-11,1
20754,RETROSPOT RED WASHING UP GLOVES,244,2011-11,1
20755,BLUE PAISLEY POCKET BOOK,51,2011-12,0
20756,GREEN FERN POCKET BOOK,22,2011-11,1
20757,RED DAISY POCKET BOOK ,33,2011-11,1
20758,ABSTRACT CIRCLES POCKET BOOK,44,2011-12,0
20759,CHRYSANTHEMUM POCKET BOOK ,20,2011-12,0
20760,GARDEN PATH POCKET BOOK,22,2011-11,1
20761,BLUE PAISLEY SKETCHBOOK,55,2011-12,0
20762,GREEN FERN SKETCHBOOK ,51,2011-12,0
20763,DAISY SKETCHBOOK ,25,2011-12,0
20764,ABSTRACT CIRCLES SKETCHBOOK ,62,2011-12,0
20765,CHRYSANTHEMUM SKETCHBOOK ,53,2011-12,0
20766,GARDEN PATH SKETCHBOOK,50,2011-12,0
20767,BLUE PAISLEY JOURNAL ,61,2011-12,0
20768,GREEN FERN JOURNAL ,37,2011-12,0
20769,DAISY JOURNAL ,26,2011-12,0
20770,ABSTRACT CIRCLE JOURNAL ,29,2011-11,1
20771,CHRYSANTHEMUM  JOURNAL,28,2011-12,0
20772,GARDEN PATH JOURNAL,47,2011-12,0
20773,BLUE PAISLEY NOTEBOOK,24,2011-09,3
20774,GREEN FERN NOTEBOOK,23,2011-09,3
20775,DAISY NOTEBOOK ,22,2011-11,1
20777,CHRYSANTHEMUM NOTEBOOK,36,2011-11,1
20778,GARDEN PATH NOTEBOOK ,8,2011-04,8
20780,BLACK EAR MUFF HEADPHONES,19,2011-11,1
20781,GOLD EAR MUFF HEADPHONES,24,2011-12,0
20782,CAMOUFLAGE EAR MUFF HEADPHONES,18,2011-12,0
20785,FUSCHIA RETRO BAR STOOL,5,2011-04,8
20793,BLUE TILED TRAY,5,2011-09,3
20794,BLUE  TILE HOOK,18,2011-12,0
20795,LARGE BLUE PROVENCAL CERAMIC BALL,10,2011-12,0
20796,SMALL BLUE PROVENCAL CERAMIC BALL,8,2011-11,1
20798,CLEAR MILKSHAKE GLASS,6,2011-01,11
20801,LARGE PINK GLASS SUNDAE DISH,57,2011-05,7
20802,SMALL GLASS SUNDAE DISH CLEAR,46,2011-12,0
20803,SMALL PINK GLASS SUNDAE DISH,34,2011-05,7
20816,GOLD FLOWER CUSHION COVER ,2,2011-04,8
20818,GOLD TEDDY BEAR,2,2011-05,7
20819,SILVER TEDDY BEAR,16,2011-11,1
20820,SILVER LOOKING MIRROR,2,2011-03,9
20821,GOLDIE LOOKING MIRROR,7,2011-11,1
20823,GOLD WINE GOBLET,8,2011-06,6
20826,SILVER APERITIF GLASS,8,2011-05,7
20827,GOLD APERITIF GLASS,2,2011-04,8
20828,GLITTER BUTTERFLY CLIPS,186,2011-12,0
20829,GLITTER HANGING BUTTERFLY STRING,175,2011-12,0
20830,SILVER PHOTO FRAME,21,2011-10,2
20831,GOLD PHOTO FRAME,24,2011-12,0
20832,RED FLOCK LOVE HEART PHOTO FRAME,58,2011-12,0
20835,FRENCH LATTICE CUSHION COVER ,7,2011-11,1
20836,FRENCH PAISLEY CUSHION COVER,18,2011-11,1
20837,FRENCH FLORAL CUSHION COVER ,15,2011-11,1
20838,FRENCH LATTICE CUSHION COVER ,34,2011-11,1
20839,FRENCH PAISLEY CUSHION COVER ,49,2011-12,0
20840,FRENCH FLORAL CUSHION COVER ,45,2011-12,0
20845,ZINC HEART LATTICE 2 WALL PLANTER,11,2011-08,4
20846,ZINC HEART LATTICE T-LIGHT HOLDER,64,2011-12,0
20847,ZINC HEART LATTICE CHARGER LARGE,14,2011-11,1
20848,ZINC HEART LATTICE CHARGER SMALL,8,2011-11,1
20851,ZINC HEART LATTICE TRAY OVAL ,7,2011-04,8
20854,BLUE PATCH PURSE PINK HEART,19,2011-02,10
20856,DENIM PATCH PURSE PINK BUTTERFLY,28,2011-08,4
20857,BLUE ROSE PATCH PURSE PINK BUTTERFL,9,2011-02,10
20861,GOLD COSMETIC BAG PINK STAR,2,2010-12,12
20866,BLUE ROSE FABRIC MIRROR,39,2011-12,0
20867,PINK ROSE FABRIC MIRROR,25,2011-12,0
20868,SILVER FABRIC MIRROR,31,2011-12,0
20869,GOLD FABRIC MIRROR,18,2011-12,0
20878,SET/9 CHRISTMAS T-LIGHTS SCENTED ,8,2010-12,12
20886,BOX OF 9 PEBBLE CANDLES,80,2011-11,1
20892,SET/3 TALL GLASS CANDLE HOLDER PINK,1,2010-12,12
20893,HANGING BAUBLE T-LIGHT HOLDER SMALL,21,2011-12,0
20894,HANGING BAUBLE T-LIGHT HOLDER LARGE,9,2011-11,1
20897,VINTAGE NOTEBOOK PARIS DAYS,10,2011-08,4
20898,VINTAGE NOTEBOOK TRAVELOGUE,6,2011-10,2
20901,VINTAGE KEEPSAKE BOX PINK FLOWER,4,2011-11,1
20902,VINTAGE KEEPSAKE BOX PARIS DAYS,6,2011-08,4
20903,VINTAGE KEEPSAKE BOX TRAVELOGUE,10,2011-10,2
20906,VINTAGE NOTEBOOK BEAUTY GIRL,2,2011-04,8
20910,VINTAGE PHOTO ALBUM PARIS DAYS,3,2010-12,12
20914,SET/5 RED RETROSPOT LID GLASS BOWLS,817,2011-12,0
20914,SET/5 RED SPOTTY LID GLASS BOWLS,1,2011-01,11
20931,BLUE POT PLANT CANDLE ,39,2011-12,0
20932,PINK POT PLANT CANDLE,24,2011-12,0
20933,YELLOW POT PLANT CANDLE,9,2011-12,0
20934,SET/3 POT PLANT CANDLES,24,2011-11,1
20935,ROUND CACTUS CANDLE,4,2011-11,1
20936,FORKED CACTUS CANDLE,27,2011-12,0
20941,FROG CANDLE,19,2011-07,5
20956,PORCELAIN T-LIGHT HOLDERS ASSORTED,63,2011-12,0
20957,PORCELAIN HANGING BELL SMALL,1,2010-12,12
20961,STRAWBERRY BATH SPONGE ,131,2011-12,0
20963,APPLE BATH SPONGE,126,2011-12,0
20964,POLYESTER FILLER PAD 60x40cm,1,2011-05,7
20966,SANDWICH BATH SPONGE,41,2011-05,7
20967,GREY FLORAL FELTCRAFT SHOULDER BAG,76,2011-05,7
20969,RED FLORAL FELTCRAFT SHOULDER BAG,262,2011-12,0
20970,PINK FLORAL FELTCRAFT SHOULDER BAG,234,2011-12,0
20971,PINK BLUE FELT CRAFT TRINKET BOX,473,2011-12,0
20972,PINK CREAM FELT CRAFT TRINKET BOX ,552,2011-12,0
20973,12 PENCIL SMALL TUBE WOODLAND,293,2011-12,0
20974,12 PENCILS SMALL TUBE SKULL,306,2011-12,0
20975,12 PENCILS SMALL TUBE RED RETROSPOT,319,2011-12,0
20977,36 PENCILS TUBE WOODLAND,149,2011-11,1
20978,36 PENCILS TUBE SKULLS,186,2011-12,0
20979,36 PENCILS TUBE RED RETROSPOT,250,2011-12,0
20980,36 PENCILS TUBE POSY,12,2011-08,4
20981,12 PENCILS TALL TUBE WOODLAND,215,2011-12,0
20982,12 PENCILS TALL TUBE SKULLS,225,2011-12,0
20983,12 PENCILS TALL TUBE RED RETROSPOT,253,2011-12,0
20984,12 PENCILS TALL TUBE POSY,177,2011-10,2
20985,HEART CALCULATOR,99,2011-12,0
20986,BLUE CALCULATOR RULER,63,2011-12,0
20992,JAZZ HEARTS PURSE NOTEBOOK,261,2011-12,0
20996,JAZZ HEARTS ADDRESS BOOK,188,2011-12,0
20997,ROSE DU SUD CUSHION COVER ,5,2011-08,4
20998,ROSE DU SUD OVEN GLOVE,28,2011-10,2
21000,ROSE DU SUD COSMETICS BAG,17,2011-11,1
21001,ROSE DU SUD WASHBAG ,13,2011-11,1
21002,ROSE DU SUD DRAWSTRING BAG,5,2011-10,2
21003,ROSE DU SUD CUSHION COVER,6,2011-09,3
21011,GLITTER SNOW PEAR TREE DECORATION,2,2010-12,12
21012,ANTIQUE ALL GLASS CANDLESTICK,84,2011-12,0
21014,SWISS CHALET TREE DECORATION ,70,2011-11,1
21015,DARK BIRD HOUSE TREE DECORATION,69,2011-12,0
21018,BIRD BOX CHRISTMAS TREE DECORATION,5,2010-12,12
21025,SPACE FROG,16,2011-11,1
21026,SPACE OWL,25,2011-11,1
21027,NINJA RABBIT PINK,19,2011-11,1
21028,NINJA RABBIT BLACK,21,2011-12,0
21030,SPACE CADET RED,23,2011-11,1
21031,SPACE CADET BLACK,11,2011-11,1
21032,SPACE CADET WHITE,16,2011-11,1
21033,JUMBO BAG CHARLIE AND LOLA TOYS,110,2011-09,3
21034,REX CASH+CARRY JUMBO SHOPPER,955,2011-12,0
21035,SET/2 RED RETROSPOT TEA TOWELS ,227,2011-12,0
21038,SET/4 MODERN VINTAGE COTTON NAPKINS,24,2011-05,7
21039,RED RETROSPOT SHOPPING BAG,79,2011-12,0
21040,MODERN VINTAGE COTTON SHOPPING BAG,8,2011-03,9
21041,RED RETROSPOT OVEN GLOVE DOUBLE,149,2011-11,1
21042,RED RETROSPOT APRON ,114,2011-12,0
21043,APRON MODERN VINTAGE COTTON,58,2011-06,6
21051,RIBBONS PURSE ,24,2011-12,0
21054,NURSE'S BAG SOFT TOY,27,2011-11,1
21055,TOOL BOX SOFT TOY ,85,2011-12,0
21056,DOCTOR'S BAG SOFT TOY,68,2011-12,0
21058,PARTY INVITES WOODLAND,93,2011-12,0
21059,PARTY INVITES DINOSAURS,78,2011-12,0
21060,PARTY INVITES BALLOON GIRL,53,2011-12,0
21061,PARTY INVITES FOOTBALL,52,2011-12,0
21062,PARTY INVITES SPACEMAN,62,2011-12,0
21063,PARTY INVITES JAZZ HEARTS,81,2011-12,0
21064,BOOM BOX SPEAKER BOYS,60,2011-12,0
21065,BOOM BOX SPEAKER GIRLS,44,2011-12,0
21066,VINTAGE RED MUG,43,2011-12,0
21067,VINTAGE RED TEATIME MUG,47,2011-10,2
21068,VINTAGE BILLBOARD LOVE/HATE MUG,129,2011-12,0
21069,VINTAGE BILLBOARD TEA MUG,53,2011-08,4
21070,VINTAGE BILLBOARD MUG ,79,2011-12,0
21071,VINTAGE BILLBOARD DRINK ME MUG,111,2011-10,2
21078,SET/20 STRAWBERRY PAPER NAPKINS ,205,2011-10,2
21080,SET/20 RED RETROSPOT PAPER NAPKINS ,755,2011-12,0
21084,SET/6 COLLAGE PAPER CUPS,107,2011-12,0
21086,SET/6 RED SPOTTY PAPER CUPS,296,2011-12,0
21087,SET/6 POSIES PAPER CUPS,10,2011-04,8
21088,SET/6 FRUIT SALAD PAPER CUPS,75,2011-12,0
21089,SET/6 GREEN SPRING PAPER CUPS,24,2011-08,4
21090,SET/6 COLLAGE PAPER PLATES,122,2011-12,0
21094,SET/6 RED SPOTTY PAPER PLATES,328,2011-12,0
21095,SET/6 POSIES PAPER PLATES,9,2011-06,6
21096,SET/6 FRUIT SALAD  PAPER PLATES,70,2011-11,1
21098,CHRISTMAS TOILET ROLL,186,2011-12,0
21100,CHARLIE AND LOLA CHARLOTTE BAG,8,2011-02,10
21106,CREAM SLICE FLANNEL CHOCOLATE SPOT ,35,2011-11,1
21107,CREAM SLICE FLANNEL PINK SPOT ,66,2011-12,0
21108,FAIRY CAKE FLANNEL ASSORTED COLOUR,200,2011-12,0
21109,LARGE CAKE TOWEL CHOCOLATE SPOTS,69,2011-12,0
21109,"LARGE CAKE TOWEL, CHOCOLATE SPOTS",4,2010-12,12
21110,LARGE CAKE TOWEL PINK SPOTS,81,2011-11,1
21111,"SWISS ROLL TOWEL, CHOCOLATE  SPOTS",52,2011-12,0
21112,SWISS ROLL TOWEL PINK  SPOTS,27,2011-11,1
21112,"SWISS ROLL TOWEL, PINK  SPOTS",19,2011-01,11
21114,LAVENDER SCENTED FABRIC HEART,134,2011-12,0
21115,ROSE CARAVAN DOORSTOP,133,2011-12,0
21116,OWL DOORSTOP,118,2011-12,0
21117,BLOND DOLL DOORSTOP,17,2011-11,1
21121,SET/10 RED POLKADOT PARTY CANDLES,346,2011-12,0
21122,SET/10 PINK POLKADOT PARTY CANDLES,318,2011-12,0
21123,SET/10 IVORY POLKADOT PARTY CANDLES,103,2011-12,0
21124,SET/10 BLUE POLKADOT PARTY CANDLES,235,2011-12,0
21125,SET 6 FOOTBALL CELEBRATION CANDLES,73,2011-12,0
21126,SET OF 6 GIRLS CELEBRATION CANDLES,69,2011-12,0
21128,GOLD FISHING GNOME,16,2011-12,0
21129,SILVER FISHING GNOME ,21,2011-11,1
21131,GOLD STANDING GNOME,17,2011-12,0
21132,SILVER STANDING GNOME   ,16,2011-12,0
21135,VICTORIAN  METAL POSTCARD SPRING,170,2011-12,0
21136,PAINTED METAL PEARS ASSORTED,364,2011-12,0
21137,BLACK RECORD COVER FRAME,322,2011-12,0
21143,ANTIQUE GLASS HEART DECORATION ,31,2011-08,4
21144,PINK POODLE HANGING DECORATION ,1,2011-01,11
21145,ANTIQUE GLASS PLACE SETTING,8,2011-11,1
21147,JINGLE BELLS TREE DECORATION,22,2011-12,0
21154,RED RETROSPOT OVEN GLOVE ,272,2011-12,0
21155,RED RETROSPOT PEG BAG,374,2011-12,0
21156,RETROSPOT CHILDRENS APRON,302,2011-12,0
21157,RED RETROSPOT WASHBAG,15,2011-10,2
21158,MOODY GIRL DOOR HANGER ,156,2011-12,0
21159,MOODY BOY  DOOR HANGER ,109,2011-12,0
21161,KEEP OUT BOYS DOOR HANGER ,37,2011-06,6
21162,TOXIC AREA  DOOR HANGER ,140,2011-12,0
21163,DO NOT TOUCH MY STUFF DOOR HANGER ,120,2011-10,2
21164,HOME SWEET HOME METAL SIGN ,251,2011-12,0
21165,BEWARE OF THE CAT METAL SIGN ,368,2011-12,0
21166,COOK WITH WINE METAL SIGN ,624,2011-12,0
21167,WHITE SAGE INCENSE,26,2011-12,0
21169,YOU'RE CONFUSING ME METAL SIGN ,361,2011-12,0
21171,BATHROOM METAL SIGN ,60,2011-08,4
21172,PARTY METAL SIGN ,385,2011-12,0
21174,POTTERING IN THE SHED METAL SIGN,380,2011-12,0
21175,GIN + TONIC DIET METAL SIGN,671,2011-11,1
21175,GIN AND TONIC DIET METAL SIGN,37,2011-12,0
21179,NO JUNK MAIL METAL SIGN,175,2011-09,3
21181,PLEASE ONE PERSON METAL SIGN,723,2011-12,0
21187,WHITE BELL HONEYCOMB PAPER GARLAND ,35,2011-07,5
21188,3D HEARTS  HONEYCOMB PAPER GARLAND,34,2011-08,4
21189,WHITE HONEYCOMB PAPER GARLAND ,29,2011-12,0
21190,PINK HEARTS PAPER GARLAND,8,2011-11,1
21191,LARGE WHITE HONEYCOMB PAPER BELL  ,44,2011-12,0
21192,WHITE BELL HONEYCOMB PAPER ,43,2011-11,1
21194,PINK  HONEYCOMB PAPER FAN,46,2011-12,0
21195,PINK  HONEYCOMB PAPER BALL ,24,2011-05,7
21196,ROUND WHITE CONFETTI IN TUBE,10,2011-12,0
21197,MULTICOLOUR  CONFETTI IN TUBE,14,2011-12,0
21198,WHITE HEART CONFETTI IN TUBE,53,2011-12,0
21199,PINK  HEART CONFETTI IN TUBE,50,2011-12,0
21200,MULTICOLOUR HONEYCOMB PAPER GARLAND,39,2011-11,1
21201,TROPICAL  HONEYCOMB PAPER GARLAND ,76,2011-12,0
21202,DOLLY HONEYCOMB GARLAND,21,2011-11,1
21204,DAISIES  HONEYCOMB GARLAND ,51,2011-12,0
21205,MULTICOLOUR 3D BALLS GARLAND,55,2011-12,0
21206,STRAWBERRY HONEYCOMB  GARLAND ,78,2011-11,1
21207,SKULL AND CROSSBONES  GARLAND ,86,2011-12,0
21208,PASTEL COLOUR HONEYCOMB FAN,62,2011-12,0
21209,MULTICOLOUR HONEYCOMB FAN,62,2011-12,0
21210,SET OF 72 RETROSPOT PAPER  DOILIES,373,2011-12,0
21211,SET OF 72 SKULL PAPER  DOILIES,68,2011-11,1
21212,PACK OF 72 RETROSPOT CAKE CASES,1080,2011-12,0
21213,PACK OF 72 SKULL CAKE CASES,512,2011-12,0
21215,IVORY PAPER CUP CAKE CASES ,66,2011-12,0
21216,"SET 3 RETROSPOT TEA,COFFEE,SUGAR",260,2011-12,0
21217,RED RETROSPOT ROUND CAKE TINS,265,2011-12,0
21218,RED SPOTTY BISCUIT TIN,217,2011-12,0
21219,SET/4 BADGES BALLOON GIRL,43,2011-12,0
21220,SET/4 BADGES DOGS,42,2011-12,0
21221,SET/4 BADGES CUTE CREATURES,24,2011-12,0
21222,SET/4 BADGES BEETLES,38,2011-12,0
21224,SET/4 SKULL BADGES,84,2011-12,0
21226,POCKET MIRROR WOODLAND,5,2011-11,1
21228,"POCKET MIRROR ""GLAMOROUS""",2,2011-03,9
21231,SWEETHEART CERAMIC TRINKET BOX,415,2011-12,0
21232,STRAWBERRY CERAMIC TRINKET BOX,570,2011-12,0
21232,STRAWBERRY CERAMIC TRINKET POT,84,2011-12,0
21238,RED RETROSPOT CUP,289,2011-12,0
21239,PINK  POLKADOT CUP,206,2011-12,0
21240,BLUE POLKADOT CUP,224,2011-12,0
21242,RED RETROSPOT PLATE ,229,2011-12,0
21243,PINK  POLKADOT PLATE ,132,2011-10,2
21243,PINK POLKADOT PLATE ,18,2011-12,0
21244,BLUE POLKADOT PLATE ,151,2011-10,2
21245,GREEN POLKADOT PLATE ,103,2011-12,0
21246,RED RETROSPOT BIG BOWL,41,2011-08,4
21248,DOOR HANGER  MUM + DADS ROOM,53,2011-12,0
21249,WOODLAND  HEIGHT CHART STICKERS ,79,2011-12,0
21250,SET OF SKULL WALL STICKERS,17,2011-11,1
21251,DINOSAUR HEIGHT CHART STICKER SET,35,2011-11,1
21253,SET OF PICTURE FRAME  STICKERS,17,2011-12,0
21257,VICTORIAN SEWING BOX MEDIUM,159,2011-12,0
21258,VICTORIAN SEWING BOX LARGE,124,2011-12,0
21259,VICTORIAN SEWING BOX SMALL ,246,2011-12,0
21260,FIRST AID TIN,152,2011-12,0
21261,GREEN GOOSE FEATHER CHRISTMAS TREE ,27,2011-12,0
21262,WHITE GOOSE FEATHER CHRISTMAS TREE ,55,2011-12,0
21263,GREEN GOOSE FEATHER TREE 60CM,40,2011-12,0
21264,WHITE GOOSE FEATHER TREE 60CM ,45,2011-12,0
21265,PINK GOOSE FEATHER TREE 60CM,16,2011-12,0
21268,VINTAGE BLUE TINSEL REEL,1,2010-12,12
21269,ANTIQUE CREAM CUTLERY SHELF ,18,2011-11,1
21270,ANTIQUE CREAM CUTLERY CUPBOARD,13,2011-12,0
21272,SALLE DE BAIN HOOK,68,2011-08,4
21275,ZINC TOP  2 DOOR WOODEN SHELF ,11,2011-11,1
21277,FRENCH STYLE EMBOSSED HEART CABINET,22,2011-11,1
21278,VINTAGE KITCHEN PRINT PUDDINGS,9,2011-07,5
21279,VINTAGE KITCHEN PRINT FRUITS,13,2011-12,0
21280,VINTAGE KITCHEN PRINT VEGETABLES,12,2011-11,1
21281,VINTAGE KITCHEN PRINT SEAFOOD,6,2011-11,1
21284,RETROSPOT CANDLE  SMALL,28,2011-12,0
21285,RETROSPOT CANDLE  MEDIUM,34,2011-12,0
21286,RETROSPOT CANDLE  LARGE,18,2011-12,0
21287,SCENTED VELVET LOUNGE CANDLE ,54,2011-12,0
21288,STRIPEY CHOCOLATE NESTING BOXES,43,2011-11,1
21289,LARGE STRIPES CHOCOLATE GIFT BAG,21,2011-11,1
21291,SMALL POLKADOT CHOCOLATE GIFT BAG ,40,2011-11,1
21292,SMALL STRIPES CHOCOLATE GIFT BAG ,26,2011-12,0
21293,MIRRORED DOVE WALL DECORATION,19,2011-12,0
21294,ETCHED GLASS COASTER,60,2011-10,2
21306,SET/4 DAISY MIRROR MAGNETS,39,2011-12,0
21307,SET/4 BUTTERFLY MIRROR MAGNETS,13,2011-07,5
21310,CAPIZ CHANDELIER,1,2011-05,7
21311,SET/4 BIRD MIRROR MAGNETS ,50,2011-12,0
21313,GLASS HEART T-LIGHT HOLDER ,141,2011-12,0
21314,SMALL GLASS HEART TRINKET POT,386,2011-12,0
21316,SMALL CHUNKY GLASS ROMAN  BOWL,10,2011-04,8
21317,GLASS SPHERE CANDLE STAND MEDIUM,29,2011-12,0
21318,GLASS CHALICE BLUE SMALL ,47,2011-05,7
21319,GLASS CHALICE GREEN  SMALL ,13,2011-04,8
21320,GLASS CHALICE GREEN  LARGE ,13,2011-04,8
21324,HANGING MEDINA LANTERN SMALL,20,2011-04,8
21326,AGED GLASS SILVER T-LIGHT HOLDER,292,2011-12,0
21327,SKULLS WRITING SET ,148,2011-12,0
21328,BALLOONS  WRITING SET ,194,2011-12,0
21329,DINOSAURS  WRITING SET ,172,2011-12,0
21331,MOROCCAN BEATEN METAL DISH LARGE,7,2011-11,1
21332,MOROCCAN BEATEN METAL MIRROR,8,2011-08,4
21333,CLASSIC WHITE FRAME,15,2011-04,8
21336,GOLD WASHBAG,3,2011-05,7
21340,CLASSIC METAL BIRDCAGE PLANT HOLDER,270,2011-12,0
21344,MOROCCAN BEATEN METAL DISH,6,2011-12,0
21348,PINK SPOTS CHOCOLATE NESTING BOXES ,5,2011-01,11
21349,IVY HEART WREATH,8,2011-11,1
21351,CINAMMON & ORANGE WREATH,35,2011-12,0
21352,EUCALYPTUS & PINECONE  WREATH,39,2011-11,1
21354,TOAST ITS - BEST MUM,70,2011-12,0
21355,TOAST ITS - I LOVE YOU ,114,2011-12,0
21356,TOAST ITS - FAIRY FLOWER,55,2011-12,0
21357,TOAST ITS - DINOSAUR,11,2011-03,9
21358,TOAST ITS - HAPPY BIRTHDAY,60,2011-12,0
21359,RELAX LARGE WOOD LETTERS,29,2011-08,4
21360,JOY LARGE WOOD LETTERS,14,2011-06,6
21361,LOVE LARGE WOOD LETTERS ,56,2011-07,5
21363,HOME SMALL WOOD LETTERS,101,2011-09,3
21364,PEACE SMALL WOOD LETTERS,22,2011-10,2
21365,MIRRORED WALL ART STARS,44,2011-12,0
21366,MIRRORED WALL ART PHOTO FRAMES,11,2011-12,0
21367,MIRRORED WALL ART GENTS,35,2011-12,0
21368,MIRRORED WALL ART LADIES,31,2011-12,0
21369,MIRRORED WALL ART SPLODGES,13,2011-12,0
21370,MIRRORED WALL ART FOXY,8,2011-12,0
21371,MIRRORED WALL ART POPPIES,32,2011-12,0
21372,MIRRORED WALL ART TABLE LAMP,25,2011-11,1
21373,MIRRORED WALL ART SNOWFLAKES,46,2011-12,0
21374,MIRRORED WALL ART SKULLS,40,2011-12,0
21375,LARGE CAMPHOR WOOD FIELD MUSHROOM ,12,2011-12,0
21376,LARGE  TALL CAMPHOR WOOD TOADSTOOL ,15,2011-12,0
21377,SMALL CAMPHOR WOOD FIELD  MUSHROOM,19,2011-12,0
21378,SMALL TALL CAMPHOR WOOD TOADSTOOL,22,2011-12,0
21379,CAMPHOR WOOD PORTOBELLO MUSHROOM,24,2011-12,0
21380,WOODEN HAPPY BIRTHDAY GARLAND,236,2011-12,0
21381,MINI WOODEN HAPPY BIRTHDAY GARLAND,146,2011-12,0
21382,SET/4 SPRING FLOWER DECORATION,97,2011-12,0
21383,PACK OF 12 STICKY BUNNIES,85,2011-12,0
21385,IVORY HANGING DECORATION  HEART,219,2011-12,0
21386,IVORY HANGING DECORATION  EGG,51,2011-12,0
21389,IVORY HANGING DECORATION  BIRD,103,2011-12,0
21390,FILIGRIS HEART WITH BUTTERFLY,184,2011-12,0
21391,FRENCH LAVENDER SCENT HEART,82,2011-11,1
21392,RED POLKADOT PUDDING BOWL,7,2011-03,9
21393,BLUE POLKADOT PUDDING BOWL,8,2011-03,9
21394,RED POLKADOT BEAKER ,118,2011-11,1
21395,BLUE POLKADOT BEAKER ,82,2011-11,1
21397,BLUE POLKADOT EGG CUP ,44,2011-04,8
21398,RED POLKADOT COFFEE  MUG,49,2011-04,8
21399,BLUE POLKADOT COFFEE MUG,67,2011-06,6
21400,RED PUDDING SPOON,48,2011-12,0
21401,BLUE PUDDING SPOON,59,2011-12,0
21402,RED  EGG  SPOON,61,2011-11,1
21403,BLUE EGG  SPOON,71,2011-12,0
21407,BROWN CHECK CAT DOORSTOP ,95,2011-11,1
21408,SPOTTY PINK DUCK DOORSTOP,69,2011-12,0
21411,GINGHAM HEART  DOORSTOP RED,191,2011-12,0
21412,VINTAGE GOLD TINSEL REEL,1,2011-01,11
21413,PERIWINKLE T-LIGHT HOLDER,10,2011-11,1
21414,SCALLOP SHELL SOAP DISH,1,2011-02,10
21415,CLAM SHELL SMALL ,32,2011-12,0
21416,CLAM SHELL LARGE,4,2011-03,9
21417,COCKLE SHELL DISH,33,2011-12,0
21418,STARFISH SOAP DISH,13,2011-12,0
21420,OYSTER TRINKET BOX,15,2011-12,0
21421,PORCELAIN ROSE LARGE ,13,2011-05,7
21422,PORCELAIN ROSE SMALL,48,2011-12,0
21424,WOODLAND STORAGE BOX LARGE ,27,2011-10,2
21425,SKULLS STORAGE BOX LARGE,16,2011-12,0
21426,WOODLAND STORAGE BOX SMALL,21,2011-11,1
21427,SKULLS STORAGE BOX SMALL,28,2011-12,0
21428,SET3 BOOK BOX GREEN GINGHAM FLOWER ,189,2011-12,0
21429,RED GINGHAM ROSE JEWELLERY BOX,233,2011-12,0
21430,SET/3 RED GINGHAM ROSE STORAGE BOX,336,2011-12,0
21439,BASKET OF TOADSTOOLS,79,2011-12,0
21441,BLUE BIRDHOUSE DECORATION,38,2011-12,0
21442,GREEN BIRDHOUSE DECORATION,37,2011-12,0
21445,12 PINK ROSE PEG PLACE SETTINGS,22,2011-07,5
21446,12 RED ROSE PEG PLACE SETTINGS,86,2011-12,0
21447,12 IVORY ROSE PEG PLACE SETTINGS,93,2011-09,3
21448,12 DAISY PEGS IN WOOD BOX,69,2011-10,2
21452,TOADSTOOL MONEY BOX,148,2011-12,0
21454,PAINTED PINK RABBIT ,47,2011-12,0
21455,PAINTED YELLOW WOODEN DAISY,36,2011-12,0
21456,2 PICTURE BOOK EGGS EASTER CHICKS,20,2011-12,0
21457,2 PICTURE BOOK EGGS EASTER DUCKS,16,2011-11,1
21458,2 PICTURE BOOK EGGS EASTER BUNNY,19,2011-11,1
21459,YELLOW EASTER EGG HUNT START POST,20,2011-11,1
21460,GREEN EASTER EGG HUNT START POST,9,2011-03,9
21461,BLUE EASTER EGG HUNT START POST,7,2011-11,1
21462,"NURSERY A,B,C PAINTED LETTERS",67,2011-12,0
21463,MIRRORED DISCO BALL ,139,2011-12,0
21464,DISCO BALL ROTATOR BATTERY OPERATED,106,2011-12,0
21465,PINK FLOWER CROCHET FOOD COVER,63,2011-12,0
21466,RED FLOWER CROCHET FOOD COVER,91,2011-12,0
21467,CHERRY CROCHET FOOD COVER,80,2011-12,0
21468,BUTTERFLY CROCHET FOOD COVER,50,2011-11,1
21469,POLKA DOT RAFFIA FOOD COVER,73,2011-12,0
21470,FLOWER VINE RAFFIA FOOD COVER,117,2011-12,0
21471,STRAWBERRY RAFFIA FOOD COVER,97,2011-11,1
21472,LADYBIRD + BEE RAFFIA FOOD COVER,33,2011-07,5
21473,SWEETHEART CREAM STEEL TABLE RECT,18,2011-11,1
21476,STEEL SWEETHEART ROUND TABLE CREAM,18,2011-10,2
21479,WHITE SKULL HOT WATER BOTTLE ,395,2011-12,0
21481,FAWN BLUE HOT WATER BOTTLE,394,2011-12,0
21484,CHICK GREY HOT WATER BOTTLE,299,2011-12,0
21485,RETROSPOT HEART HOT WATER BOTTLE,556,2011-12,0
21486,PINK HEART DOTS HOT WATER BOTTLE,4,2010-12,12
21488,RED WHITE SCARF  HOT WATER BOTTLE,2,2010-12,12
21494,ROTATING LEAVES T-LIGHT HOLDER,135,2011-12,0
21495,SKULLS AND CROSSBONES WRAP,166,2011-12,0
21497,FANCY FONTS BIRTHDAY WRAP,232,2011-12,0
21498,RED RETROSPOT WRAP ,338,2011-12,0
21499,BLUE POLKADOT WRAP,218,2011-12,0
21500,PINK POLKADOT WRAP ,213,2011-12,0
21503,TOYBOX  WRAP ,24,2011-11,1
21504,SKULLS GREETING CARD,97,2011-12,0
21506,"FANCY FONT BIRTHDAY CARD, ",254,2011-12,0
21507,ELEPHANT BIRTHDAY CARD ,74,2011-12,0
21507,"ELEPHANT, BIRTHDAY CARD, ",127,2011-08,4
21508,VINTAGE KID DOLLY CARD ,147,2011-12,0
21509,COWBOYS AND INDIANS BIRTHDAY CARD ,203,2011-12,0
21518,BANK ACCOUNT  GREETING  CARD ,17,2011-04,8
21519,GIN & TONIC DIET GREETING CARD ,194,2011-12,0
21520,BOOZE & WOMEN GREETING CARD ,34,2011-11,1
21523,DOORMAT FANCY FONT HOME SWEET HOME,401,2011-12,0
21524,DOORMAT SPOTTY HOME SWEET HOME,413,2011-12,0
21527,RED RETROSPOT TRADITIONAL TEAPOT ,159,2011-05,7
