StockCode,ProductName,Count,LatestMonth,UnsoldDuration
22279,POCKET BAG BLUE PAISLEY RED SPOT,52,2011-12,0
22280,POCKET BAG PINK PAISELY BROWN SPOT,32,2011-12,0
22281,EASTER TREE YELLOW BIRDS,44,2011-12,0
22282,12 EGG HOUSE PAINTED WOOD,65,2011-12,0
22283,6 EGG HOUSE PAINTED WOOD,120,2011-12,0
22284,HEN HOUSE DECORATION,106,2011-12,0
22285,"DECORATION HEN ON NEST, HANGING",3,2010-12,12
22285,HANGING HEN ON NEST DECORATION,91,2011-12,0
22286,"DECORATION , WOBBLY RABBIT , METAL ",37,2011-04,8
22286,DECORATION WOBBLY RABBIT METAL ,45,2011-12,0
22287,"DECORATION , WOBBLY CHICKEN, METAL ",30,2011-04,8
22287,DECORATION WOBBLY CHICKEN,30,2011-12,0
22288,HANGING METAL RABBIT DECORATION,44,2011-11,1
22289,HANGING METAL CHICKEN DECORATION,22,2011-11,1
22291,HANGING CHICK CREAM DECORATION,98,2011-11,1
22292,HANGING CHICK  YELLOW DECORATION,95,2011-11,1
22293,HANGING CHICK GREEN DECORATION,89,2011-11,1
22294,HEART FILIGREE DOVE  SMALL,264,2011-12,0
22295,HEART FILIGREE DOVE LARGE,222,2011-12,0
22296,HEART IVORY TRELLIS LARGE,285,2011-12,0
22297,HEART IVORY TRELLIS SMALL,232,2011-12,0
22299,PIG KEYRING WITH LIGHT & SOUND ,45,2011-12,0
22300,COFFEE MUG DOG + BALL DESIGN,151,2011-12,0
22301,COFFEE MUG CAT + BIRD DESIGN,196,2011-12,0
22302,COFFEE MUG PEARS  DESIGN,195,2011-12,0
22303,COFFEE MUG APPLES DESIGN,241,2011-12,0
22304,COFFEE MUG BLUE PAISLEY DESIGN,48,2011-12,0
22305,COFFEE MUG PINK PAISLEY DESIGN,45,2011-12,0
22306,SILVER MUG BONE CHINA TREE OF LIFE,107,2011-12,0
22307,GOLD MUG BONE CHINA TREE OF LIFE,67,2011-12,0
22308,TEA COSY BLUE STRIPE,36,2011-12,0
22309,TEA COSY RED  STRIPE,66,2011-12,0
22310,IVORY KNITTED MUG COSY ,53,2011-12,0
22311,OFFICE MUG WARMER BLACK+SILVER ,102,2011-12,0
22312,OFFICE MUG WARMER POLKADOT,99,2011-12,0
22313,OFFICE MUG WARMER PINK,57,2011-12,0
22314,OFFICE MUG WARMER CHOC+BLUE,97,2011-12,0
22315,200 RED + WHITE BENDY STRAWS,122,2011-12,0
22316,200 BENDY SKULL STRAWS,43,2011-12,0
22317,FIVE CATS HANGING DECORATION,40,2011-11,1
22318,FIVE HEART HANGING DECORATION,92,2011-12,0
22319,HAIRCLIPS FORTIES FABRIC ASSORTED,64,2011-12,0
22320,BIRDS MOBILE VINTAGE DESIGN,73,2011-12,0
22321,BIRD DECORATION RED RETROSPOT,59,2011-12,0
22322,BIRD DECORATION GREEN POLKADOT,38,2011-11,1
22323,PINK POLKADOT KIDS BAG,1,2011-01,11
22324,BLUE POLKADOT KIDS BAG,30,2011-12,0
22325,MOBILE VINTAGE HEARTS ,65,2011-11,1
22326,ROUND SNACK BOXES SET OF4 WOODLAND ,627,2011-12,0
22327,ROUND SNACK BOXES SET OF 4 SKULLS,178,2011-12,0
22328,ROUND SNACK BOXES SET OF 4 FRUITS ,486,2011-12,0
22329,ROUND CONTAINER SET OF 5 RETROSPOT,156,2011-12,0
22331,WOODLAND PARTY BAG + STICKER SET,145,2011-12,0
22332,SKULLS PARTY BAG + STICKER SET,134,2011-12,0
22333,RETROSPOT PARTY BAG + STICKER SET,283,2011-12,0
22334,DINOSAUR PARTY BAG + STICKER SET,92,2011-12,0
22335,HEART DECORATION PAINTED ZINC ,133,2011-12,0
22336,DOVE DECORATION PAINTED ZINC ,54,2011-10,2
22337,ANGEL DECORATION PAINTED ZINC ,27,2011-12,0
22338,STAR DECORATION PAINTED ZINC ,123,2011-12,0
22339,CHRISTMAS TREE PAINTED ZINC ,57,2011-11,1
22340,NOEL GARLAND PAINTED ZINC ,64,2011-12,0
22341,LOVE GARLAND PAINTED ZINC ,41,2011-12,0
22342,HOME GARLAND PAINTED ZINC ,54,2011-11,1
22343,PARTY PIZZA DISH RED RETROSPOT,65,2011-12,0
22344,PARTY PIZZA DISH PINK POLKADOT,47,2011-12,0
22345,PARTY PIZZA DISH BLUE POLKADOT,45,2011-12,0
22346,PARTY PIZZA DISH GREEN POLKADOT,34,2011-12,0
22348,TEA BAG PLATE RED RETROSPOT,260,2011-12,0
22349,DOG BOWL CHASING BALL DESIGN,118,2011-12,0
22350,ILLUSTRATED CAT BOWL ,90,2011-12,0
22351,DOTCOMGIFTSHOP TEA TOWEL,1,2011-02,10
22352,LUNCH BOX WITH CUTLERY RETROSPOT ,340,2011-12,0
22353,LUNCH BOX WITH CUTLERY FAIRY CAKES ,25,2011-05,7
22354,RETROSPOT PADDED SEAT CUSHION,66,2011-11,1
22355,CHARLOTTE BAG SUKI DESIGN,611,2011-12,0
22356,CHARLOTTE BAG PINK POLKADOT,514,2011-12,0
22357,KINGS CHOICE BISCUIT TIN,95,2011-12,0
22358,KINGS CHOICE TEA CADDY ,117,2011-12,0
22359,GLASS JAR KINGS CHOICE,65,2011-12,0
22360,GLASS JAR ENGLISH CONFECTIONERY,167,2011-12,0
22361,GLASS JAR DAISY FRESH COTTON WOOL,132,2011-12,0
22362,GLASS JAR PEACOCK BATH SALTS,88,2011-12,0
22363,GLASS JAR MARMALADE ,64,2011-12,0
22364,GLASS JAR DIGESTIVE BISCUITS,113,2011-12,0
22365,DOORMAT RESPECTABLE HOUSE,128,2011-12,0
22366,DOORMAT AIRMAIL ,159,2011-12,0
22367,CHILDRENS APRON SPACEBOY DESIGN,469,2011-12,0
22371,AIRLINE BAG VINTAGE TOKYO 78,263,2011-12,0
22372,AIRLINE BAG VINTAGE WORLD CHAMPION ,102,2011-12,0
22374,AIRLINE BAG VINTAGE JET SET RED,162,2011-12,0
22375,AIRLINE BAG VINTAGE JET SET BROWN,99,2011-12,0
22376,AIRLINE BAG VINTAGE JET SET WHITE,85,2011-12,0
22377,BOTTLE BAG RETROSPOT ,107,2011-12,0
22378,WALL TIDY RETROSPOT ,106,2011-12,0
22379,RECYCLING BAG RETROSPOT ,419,2011-12,0
22380,TOY TIDY SPACEBOY  ,206,2011-12,0
22381,TOY TIDY PINK POLKADOT,302,2011-12,0
22382,LUNCH BAG SPACEBOY DESIGN ,1021,2011-12,0
22383,LUNCH BAG SUKI  DESIGN ,153,2011-04,8
22383,LUNCH BAG SUKI DESIGN ,950,2011-12,0
22384,LUNCH BAG PINK POLKADOT,977,2011-12,0
22385,JUMBO BAG SPACEBOY DESIGN,492,2011-12,0
22386,JUMBO BAG PINK POLKADOT,903,2011-12,0
22389,PAPERWEIGHT SAVE THE PLANET,37,2011-12,0
22390,PAPERWEIGHT CHILDHOOD MEMORIES,31,2011-12,0
22391,PAPERWEIGHT HOME SWEET HOME,18,2011-12,0
22393,PAPERWEIGHT VINTAGE COLLAGE,52,2011-12,0
22394,PAPERWEIGHT KINGS CHOICE ,17,2011-12,0
22395,PAPERWEIGHT VINTAGE PAISLEY,15,2011-12,0
22396,MAGNETS PACK OF 4 RETRO PHOTO,113,2011-12,0
22398,MAGNETS PACK OF 4 SWALLOWS,235,2011-12,0
22399,MAGNETS PACK OF 4 CHILDHOOD MEMORY,89,2011-12,0
22400,MAGNETS PACK OF 4 HOME SWEET HOME,153,2011-12,0
22402,MAGNETS PACK OF 4 VINTAGE COLLAGE,150,2011-12,0
22403,MAGNETS PACK OF 4 VINTAGE LABELS ,87,2011-12,0
22405,MONEY BOX POCKET MONEY DESIGN,57,2011-12,0
22406,MONEY BOX KINGS CHOICE DESIGN,65,2011-12,0
22407,MONEY BOX FIRST ADE DESIGN,14,2011-07,5
22407,MONEY BOX FIRST AID DESIGN,10,2011-12,0
22408,MONEY BOX CONFECTIONERY DESIGN,23,2011-12,0
22409,MONEY BOX BISCUITS DESIGN,46,2011-12,0
22410,MONEY BOX HOUSEKEEPING DESIGN,46,2011-12,0
22411,JUMBO SHOPPER VINTAGE RED PAISLEY,814,2011-12,0
22412,METAL SIGN NEIGHBOURHOOD WITCH ,118,2011-11,1
22413,METAL SIGN TAKE IT OR LEAVE IT ,361,2011-12,0
22414,DOORMAT NEIGHBOURHOOD WITCH ,72,2011-12,0
22415,WHITE TISSUE REAM,13,2011-01,11
22416,SET OF 36 DOILIES SPACEBOY DESIGN ,56,2011-10,2
22416,SET OF 36 SPACEBOY PAPER DOILIES,8,2011-12,0
22417,PACK OF 60 SPACEBOY CAKE CASES,422,2011-12,0
22418,10 COLOUR SPACEBOY PEN,250,2011-12,0
22419,LIPSTICK PEN RED,167,2011-12,0
22420,LIPSTICK PEN BABY PINK,87,2011-12,0
22421,LIPSTICK PEN FUSCHIA,124,2011-12,0
22422,TOOTHPASTE TUBE PEN,77,2011-12,0
22423,REGENCY CAKESTAND 3 TIER,1905,2011-12,0
22424,ENAMEL BREAD BIN CREAM,345,2011-12,0
22425,ENAMEL COLANDER CREAM,144,2011-12,0
22426,ENAMEL WASH BOWL CREAM,149,2011-12,0
22427,ENAMEL FLOWER JUG CREAM,459,2011-11,1
22428,ENAMEL FIRE BUCKET CREAM,94,2011-12,0
22429,ENAMEL MEASURING JUG CREAM,340,2011-12,0
22430,ENAMEL WATERING CAN CREAM,173,2011-12,0
22431,WATERING CAN BLUE ELEPHANT,282,2011-12,0
22432,WATERING CAN PINK BUNNY,243,2011-12,0
22433,WATERING CAN GREEN DINOSAUR,194,2011-12,0
22434,BALLOON PUMP WITH 10 BALLOONS,118,2011-12,0
22435,SET OF 9 HEART SHAPED BALLOONS,222,2011-12,0
22436,12 COLOURED PARTY BALLOONS,146,2011-12,0
22437,SET OF 9 BLACK SKULL BALLOONS,178,2011-12,0
22438,BALLOON ART MAKE YOUR OWN FLOWERS,74,2011-12,0
22439,6 ROCKET BALLOONS ,166,2011-12,0
22440,BALLOON WATER BOMB PACK OF 35,147,2011-12,0
22441,GROW YOUR OWN BASIL IN ENAMEL MUG,176,2011-12,0
22442,GROW YOUR OWN FLOWERS SET OF 3,81,2011-12,0
22443,GROW YOUR OWN HERBS SET OF 3,83,2011-08,4
22444,GROW YOUR OWN PLANT IN A CAN ,37,2011-07,5
22445,PENCIL CASE LIFE IS BEAUTIFUL,100,2011-12,0
22446,PIN CUSHION BABUSHKA PINK,41,2011-12,0
22447,PIN CUSHION BABUSHKA BLUE,16,2011-12,0
22448,PIN CUSHION BABUSHKA RED,34,2011-12,0
22449,SILK PURSE BABUSHKA PINK,90,2011-11,1
22450,SILK PURSE BABUSHKA BLUE,55,2011-11,1
22451,SILK PURSE BABUSHKA RED,39,2011-05,7
22452,MEASURING TAPE BABUSHKA PINK,69,2011-12,0
22453,MEASURING TAPE BABUSHKA BLUE,47,2011-12,0
22454,MEASURING TAPE BABUSHKA RED,38,2011-11,1
22456,NATURAL SLATE CHALKBOARD LARGE ,338,2011-12,0
22457,NATURAL SLATE HEART CHALKBOARD ,997,2011-12,0
22458,CAST IRON HOOK GARDEN FORK,14,2011-04,8
22459,CAST IRON HOOK GARDEN TROWEL,15,2011-04,8
22460,EMBOSSED GLASS TEALIGHT HOLDER,170,2011-12,0
22461,SAVOY ART DECO CLOCK,57,2011-09,3
22464,HANGING METAL HEART LANTERN,297,2011-12,0
22465,HANGING METAL STAR LANTERN,170,2011-12,0
22466,FAIRY TALE COTTAGE NIGHT LIGHT,84,2011-12,0
22466,FAIRY TALE COTTAGE NIGHTLIGHT,70,2011-10,2
22467,GUMBALL COAT RACK,615,2011-12,0
22468,BABUSHKA LIGHTS STRING OF 10,118,2011-12,0
22469,HEART OF WICKER SMALL,996,2011-12,0
22470,HEART OF WICKER LARGE,835,2011-12,0
22471,TV DINNER TRAY AIR HOSTESS ,66,2011-12,0
22472,TV DINNER TRAY DOLLY GIRL,84,2011-12,0
22473,TV DINNER TRAY VINTAGE PAISLEY,79,2011-12,0
22474,SPACEBOY TV DINNER TRAY,84,2011-12,0
22475,SKULL DESIGN TV DINNER TRAY,112,2011-12,0
22476,EMPIRE UNION JACK TV DINNER TRAY,80,2011-12,0
22477,WATERING CAN GARDEN MARKER,72,2011-11,1
22478,BIRDHOUSE GARDEN MARKER ,77,2011-12,0
22479,DAISY GARDEN MARKER,54,2011-12,0
22480,RED TEA TOWEL CLASSIC DESIGN,68,2011-08,4
22481,BLACK TEA TOWEL CLASSIC DESIGN,87,2011-12,0
22482,BLUE TEA TOWEL CLASSIC DESIGN,48,2011-07,5
22483,RED GINGHAM TEDDY BEAR ,135,2011-12,0
22485,SET OF 2 WOODEN MARKET CRATES,169,2011-12,0
22486,PLASMATRONIC LAMP,13,2011-12,0
22487,WHITE WOOD GARDEN PLANT LADDER,397,2011-12,0
22488,NATURAL SLATE RECTANGLE CHALKBOARD,321,2011-12,0
22489,PACK OF 12 TRADITIONAL CRAYONS,324,2011-12,0
22491,PACK OF 12 COLOURED PENCILS,204,2011-12,0
22492,MINI PAINT SET VINTAGE ,335,2011-12,0
22493,PAINT YOUR OWN CANVAS SET,184,2011-12,0
22494,EMERGENCY FIRST AID TIN ,126,2011-12,0
22495,SET OF 2 ROUND TINS CAMEMBERT ,67,2011-12,0
22496,SET OF 2 ROUND TINS DUTCH CHEESE,71,2011-12,0
22497,SET OF 2 TINS VINTAGE BATHROOM ,60,2011-12,0
22498,WOODEN REGATTA BUNTING,97,2011-12,0
22499,WOODEN UNION JACK BUNTING,301,2011-12,0
22500,SET OF 2 TINS JARDIN DE PROVENCE,90,2011-12,0
22501,PICNIC BASKET WICKER LARGE,276,2011-11,1
22502,PICNIC BASKET WICKER 60 PIECES,2,2011-06,6
22502,PICNIC BASKET WICKER SMALL,246,2011-09,3
22503,CABIN BAG VINTAGE PAISLEY,18,2011-11,1
22504,CABIN BAG VINTAGE RETROSPOT,43,2011-12,0
22505,MEMO BOARD COTTAGE DESIGN,273,2011-12,0
22507,MEMO BOARD RETROSPOT  DESIGN,353,2011-12,0
22508,DOORSTOP RETROSPOT HEART,244,2011-12,0
22509,SEWING BOX RETROSPOT DESIGN ,84,2011-12,0
22510,GINGHAM BABUSHKA DOORSTOP,42,2011-12,0
22511,RETROSPOT BABUSHKA DOORSTOP,48,2011-12,0
22512,DOORSTOP RACING CAR DESIGN,33,2011-12,0
22513,DOORSTOP FOOTBALL DESIGN,52,2011-12,0
22514,CHILDS GARDEN SPADE BLUE,76,2011-11,1
22515,CHILDS GARDEN SPADE PINK,64,2011-12,0
22516,CHILDS GARDEN RAKE BLUE,44,2011-11,1
22517,CHILDS GARDEN RAKE PINK,58,2011-12,0
22518,CHILDS GARDEN BRUSH BLUE,57,2011-05,7
22519,CHILDS GARDEN BRUSH PINK,65,2011-06,6
22520,CHILDS GARDEN TROWEL BLUE ,107,2011-05,7
22521,CHILDS GARDEN TROWEL PINK,100,2011-05,7
22522,CHILDS GARDEN FORK BLUE ,125,2011-12,0
22523,CHILDS GARDEN FORK PINK,120,2011-12,0
22524,CHILDRENS GARDEN GLOVES BLUE,66,2011-05,7
22525,CHILDRENS GARDEN GLOVES PINK,52,2011-04,8
22526,WHEELBARROW FOR CHILDREN ,71,2011-12,0
22529,MAGIC DRAWING SLATE GO TO THE FAIR ,62,2011-12,0
22530,MAGIC DRAWING SLATE DOLLY GIRL ,187,2011-12,0
22531,MAGIC DRAWING SLATE CIRCUS PARADE  ,166,2011-12,0
22532,MAGIC DRAWING SLATE LEAP FROG ,68,2011-12,0
22533,MAGIC DRAWING SLATE BAKE A CAKE ,80,2011-12,0
22534,MAGIC DRAWING SLATE SPACEBOY ,208,2011-12,0
22535,MAGIC DRAWING SLATE BUNNIES ,114,2011-12,0
22536,MAGIC DRAWING SLATE PURDEY,149,2011-12,0
22537,MAGIC DRAWING SLATE DINOSAUR,139,2011-12,0
22538,MINI JIGSAW GO TO THE FAIR,27,2011-12,0
22539,MINI JIGSAW DOLLY GIRL,90,2011-12,0
22540,MINI JIGSAW CIRCUS PARADE ,66,2011-12,0
22541,MINI JIGSAW LEAP FROG,22,2011-12,0
22543,MINI JIGSAW BAKE A CAKE ,41,2011-12,0
22544,MINI JIGSAW SPACEBOY,129,2011-12,0
22545,MINI JIGSAW BUNNIES,49,2011-12,0
22546,MINI JIGSAW PURDEY,61,2011-12,0
22547,MINI JIGSAW DINOSAUR ,52,2011-12,0
22548,HEADS AND TAILS SPORTING FUN,184,2011-11,1
22549,PICTURE DOMINOES,250,2011-12,0
22550,HOLIDAY FUN LUDO,178,2011-12,0
22551,PLASTERS IN TIN SPACEBOY,602,2011-12,0
22553,PLASTERS IN TIN SKULLS,472,2011-12,0
22554,PLASTERS IN TIN WOODLAND ANIMALS,610,2011-12,0
22555,PLASTERS IN TIN STRONGMAN,465,2011-12,0
22556,PLASTERS IN TIN CIRCUS PARADE ,541,2011-12,0
22557,PLASTERS IN TIN VINTAGE PAISLEY ,502,2011-12,0
22558,CLOTHES PEGS RETROSPOT PACK 24 ,659,2011-12,0
22559,SEASIDE FLYING DISC,39,2011-12,0
22560,TRADITIONAL MODELLING CLAY,338,2011-12,0
22561,WOODEN SCHOOL COLOURING SET,411,2011-12,0
22562,MONSTERS STENCIL CRAFT,196,2011-12,0
22563,HAPPY STENCIL CRAFT,263,2011-12,0
22564,ALPHABET STENCIL CRAFT,171,2011-12,0
22565,FELTCRAFT HAIRBANDS PINK AND WHITE ,110,2011-12,0
22566,FELTCRAFT HAIRBAND PINK AND PURPLE,124,2011-12,0
22567,20 DOLLY PEGS RETROSPOT,195,2011-12,0
22568,FELTCRAFT CUSHION OWL,434,2011-12,0
22569,FELTCRAFT CUSHION BUTTERFLY,304,2011-10,2
22570,FELTCRAFT CUSHION RABBIT,336,2011-11,1
22571,ROCKING HORSE RED CHRISTMAS ,188,2011-12,0
22572,ROCKING HORSE GREEN CHRISTMAS ,133,2011-11,1
22573,STAR WOODEN CHRISTMAS DECORATION,156,2011-12,0
22574,HEART WOODEN CHRISTMAS DECORATION,161,2011-12,0
22575,METAL MERRY CHRISTMAS WREATH,80,2011-12,0
22576,SWALLOW WOODEN CHRISTMAS DECORATION,131,2011-12,0
22577,WOODEN HEART CHRISTMAS SCANDINAVIAN,482,2011-12,0
22578,WOODEN STAR CHRISTMAS SCANDINAVIAN,456,2011-12,0
22579,WOODEN TREE CHRISTMAS SCANDINAVIAN,289,2011-11,1
22580,ADVENT CALENDAR GINGHAM SACK,172,2011-12,0
22581,WOOD STOCKING CHRISTMAS SCANDISPOT,105,2011-12,0
22582,PACK OF 6 SWEETIE GIFT BOXES,80,2011-12,0
22583,PACK OF 6 HANDBAG GIFT BOXES,81,2011-12,0
22584,PACK OF 6 PANETTONE GIFT BOXES,15,2011-12,0
22584,PACK OF 6 PANNETONE GIFT BOXES,143,2011-11,1
22585,PACK OF 6 BIRDY GIFT TAGS,343,2011-12,0
22586,FELTCRAFT HAIRBAND PINK AND BLUE,120,2011-12,0
22587,FELTCRAFT HAIRBAND RED AND BLUE,124,2011-12,0
22588,CARD HOLDER GINGHAM HEART,140,2011-12,0
22589,CARDHOLDER GINGHAM STAR,58,2011-12,0
22591,CARDHOLDER GINGHAM CHRISTMAS TREE,69,2011-12,0
22592,CARDHOLDER HOLLY WREATH METAL,93,2011-12,0
22593,CHRISTMAS GINGHAM STAR,143,2011-12,0
22594,CHRISTMAS GINGHAM TREE,127,2011-12,0
22595,CHRISTMAS GINGHAM HEART,31,2011-01,11
22595,GINGHAM HEART DECORATION,340,2011-12,0
22596,CHRISTMAS STAR WISH LIST CHALKBOARD,246,2011-12,0
22597,CHRISTMAS MUSICAL ZINC HEART ,5,2010-12,12
22597,MUSICAL ZINC HEART DECORATION ,120,2011-12,0
22598,CHRISTMAS MUSICAL ZINC TREE,55,2011-12,0
22599,CHRISTMAS MUSICAL ZINC STAR,72,2011-12,0
22600,CHRISTMAS RETROSPOT STAR WOOD,148,2011-12,0
22601,CHRISTMAS RETROSPOT ANGEL WOOD,157,2011-12,0
22602,CHRISTMAS RETROSPOT HEART WOOD,11,2010-12,12
22602,RETROSPOT WOODEN HEART DECORATION,172,2011-12,0
22603,CHRISTMAS RETROSPOT TREE WOOD,133,2011-12,0
22604,SET OF 4 NAPKIN CHARMS CUTLERY,114,2011-12,0
22605,WOODEN CROQUET GARDEN SET,248,2011-12,0
22606,WOODEN SKITTLES GARDEN SET,143,2011-12,0
22607,WOODEN ROUNDERS GARDEN SET ,311,2011-12,0
22608,PENS ASSORTED FUNKY JEWELED ,86,2011-12,0
22609,PENS ASSORTED SPACEBALL,122,2011-12,0
22610,PENS ASSORTED FUNNY FACE,173,2011-12,0
22611,VINTAGE UNION JACK SHOPPING BAG,41,2011-11,1
22613,PACK OF 20 SPACEBOY NAPKINS,116,2011-12,0
22614,PACK OF 12 SPACEBOY TISSUES,179,2011-12,0
22615,PACK OF 12 CIRCUS PARADE TISSUES ,71,2011-12,0
22616,PACK OF 12 LONDON TISSUES ,399,2011-12,0
22617,BAKING SET SPACEBOY DESIGN,442,2011-12,0
22618,COOKING SET RETROSPOT,28,2011-05,7
22619,SET OF 6 SOLDIER SKITTLES,348,2011-12,0
22620,4 TRADITIONAL SPINNING TOPS,377,2011-12,0
22621,TRADITIONAL KNITTING NANCY,525,2011-12,0
22622,BOX OF VINTAGE ALPHABET BLOCKS,236,2011-12,0
22623,BOX OF VINTAGE JIGSAW BLOCKS ,226,2011-12,0
22624,IVORY KITCHEN SCALES,645,2011-12,0
22625,RED KITCHEN SCALES,474,2011-12,0
22626,BLACK KITCHEN SCALES,190,2011-12,0
22627,MINT KITCHEN SCALES,320,2011-12,0
22628,PICNIC BOXES SET OF 3 RETROSPOT ,131,2011-12,0
22629,SPACEBOY LUNCH BOX ,728,2011-12,0
22630,DOLLY GIRL LUNCH BOX,645,2011-12,0
22631,CIRCUS PARADE LUNCH BOX ,267,2011-12,0
22632,HAND WARMER RED POLKA DOT,18,2010-12,12
22632,HAND WARMER RED RETROSPOT,361,2011-12,0
22633,HAND WARMER UNION JACK,477,2011-12,0
22634,CHILDS BREAKFAST SET SPACEBOY ,231,2011-12,0
22635,CHILDS BREAKFAST SET DOLLY GIRL ,190,2011-12,0
22636,CHILDS BREAKFAST SET CIRCUS PARADE,197,2011-12,0
22637,PIGGY BANK RETROSPOT ,289,2011-11,1
22638,SET OF 4 NAPKIN CHARMS CROWNS ,39,2011-12,0
22639,SET OF 4 NAPKIN CHARMS HEARTS,131,2011-12,0
22640,SET OF 4 NAPKIN CHARMS 3 KEYS ,42,2011-12,0
22641,SET OF 4 NAPKIN CHARMS INSTRUMENT,24,2011-12,0
22642,SET OF 4 NAPKIN CHARMS STARS   ,45,2011-12,0
22643,SET OF 4 NAPKIN CHARMS LEAVES   ,32,2011-12,0
22644,CERAMIC CHERRY CAKE MONEY BANK,194,2011-12,0
22645,CERAMIC HEART FAIRY CAKE MONEY BANK,241,2011-12,0
22646,CERAMIC STRAWBERRY CAKE MONEY BANK,293,2011-12,0
22647,CERAMIC LOVE HEART MONEY BANK,37,2011-12,0
22649,STRAWBERRY FAIRY CAKE TEAPOT,187,2011-12,0
22650,CERAMIC PIRATE CHEST MONEY BANK,110,2011-12,0
22651,GENTLEMAN SHIRT REPAIR KIT ,94,2011-12,0
22652,TRAVEL SEWING KIT,404,2011-11,1
22653,BUTTON BOX ,124,2011-12,0
22654,DELUXE SEWING KIT ,238,2011-12,0
22655,VINTAGE RED KITCHEN CABINET,46,2011-11,1
22656,VINTAGE BLUE KITCHEN CABINET,26,2011-10,2
22659,LUNCH BOX I LOVE LONDON,547,2011-12,0
22660,DOORMAT I LOVE LONDON,69,2011-12,0
22661,CHARLOTTE BAG DOLLY GIRL DESIGN,353,2011-12,0
22662,LUNCH BAG DOLLY GIRL DESIGN,621,2011-12,0
22663,JUMBO BAG DOLLY GIRL DESIGN,320,2011-12,0
22664,TOY TIDY DOLLY GIRL DESIGN,105,2011-12,0
22665,RECIPE BOX BLUE SKETCHBOOK DESIGN,241,2011-11,1
22666,RECIPE BOX PANTRY YELLOW DESIGN,890,2011-12,0
22667,RECIPE BOX RETROSPOT ,476,2011-12,0
22668,PINK BABY BUNTING,210,2011-12,0
22669,RED BABY BUNTING ,168,2011-12,0
22670,FRENCH WC SIGN BLUE METAL,213,2011-12,0
22671,FRENCH LAUNDRY SIGN BLUE METAL,105,2011-12,0
22672,FRENCH BATHROOM SIGN BLUE METAL,163,2011-12,0
22673,FRENCH GARDEN SIGN BLUE METAL,114,2011-12,0
22674,FRENCH TOILET SIGN BLUE METAL,150,2011-12,0
22675,FRENCH KITCHEN SIGN BLUE METAL,131,2011-12,0
22676,FRENCH BLUE METAL DOOR SIGN 1,142,2011-12,0
22677,FRENCH BLUE METAL DOOR SIGN 2,115,2011-12,0
22678,FRENCH BLUE METAL DOOR SIGN 3,105,2011-12,0
22679,FRENCH BLUE METAL DOOR SIGN 4,93,2011-12,0
22680,FRENCH BLUE METAL DOOR SIGN 5,105,2011-12,0
22681,FRENCH BLUE METAL DOOR SIGN 6,86,2011-12,0
22682,FRENCH BLUE METAL DOOR SIGN 7,82,2011-12,0
22683,FRENCH BLUE METAL DOOR SIGN 8,82,2011-12,0
22684,FRENCH BLUE METAL DOOR SIGN 9,64,2011-12,0
22685,FRENCH BLUE METAL DOOR SIGN 0,71,2011-12,0
22686,FRENCH BLUE METAL DOOR SIGN No,75,2011-12,0
22687,DOORMAT CHRISTMAS VILLAGE,35,2011-12,0
22688,DOORMAT PEACE ON EARTH BLUE,27,2011-12,0
22689,DOORMAT MERRY CHRISTMAS RED ,115,2011-11,1
22690,DOORMAT HOME SWEET HOME BLUE ,268,2011-12,0
22691,DOORMAT WELCOME SUNRISE,98,2011-12,0
22692,DOORMAT WELCOME TO OUR HOME,342,2011-12,0
22693,GROW A FLYTRAP OR SUNFLOWER IN TIN,241,2011-12,0
22694,WICKER STAR ,316,2011-12,0
22695,WICKER WREATH SMALL,98,2011-12,0
22696,WICKER WREATH LARGE,130,2011-12,0
22697,GREEN REGENCY TEACUP AND SAUCER,761,2011-12,0
22698,PINK REGENCY TEACUP AND SAUCER,619,2011-12,0
22699,ROSES REGENCY TEACUP AND SAUCER ,854,2011-12,0
22700,BLACK AND WHITE DOG BOWL,53,2011-10,2
22701,PINK DOG BOWL,58,2011-12,0
22702,BLACK AND WHITE CAT BOWL,43,2011-11,1
22703,PINK CAT BOWL,40,2011-12,0
22704,WRAP RED APPLES ,176,2011-12,0
22705,WRAP GREEN PEARS ,76,2011-12,0
22706,WRAP COWBOYS  ,70,2011-12,0
22707,WRAP MONSTER FUN ,47,2011-12,0
22708,WRAP DOLLY GIRL,100,2011-12,0
22709,WRAP WEDDING DAY,39,2011-12,0
22710,WRAP I LOVE LONDON ,101,2011-12,0
22711,WRAP CIRCUS PARADE,102,2011-12,0
22712,CARD DOLLY GIRL ,219,2011-12,0
22713,CARD I LOVE LONDON ,156,2011-12,0
22714,CARD BIRTHDAY COWBOY,156,2011-12,0
22715,CARD WEDDING DAY,98,2011-11,1
22716,CARD CIRCUS PARADE,215,2011-12,0
22717,CARD DOG AND BALL ,87,2011-11,1
22718,CARD CAT AND TREE ,108,2011-12,0
22719,GUMBALL MONOCHROME COAT RACK,38,2011-05,7
22720,SET OF 3 CAKE TINS PANTRY DESIGN ,1232,2011-12,0
22721,SET OF 3 CAKE TINS SKETCHBOOK,249,2011-12,0
22722,SET OF 6 SPICE TINS PANTRY DESIGN,686,2011-12,0
22723,SET OF 6 HERB TINS SKETCHBOOK,245,2011-12,0
22725,ALARM CLOCK BAKELIKE CHOCOLATE,344,2011-12,0
22726,ALARM CLOCK BAKELIKE GREEN,831,2011-12,0
22727,ALARM CLOCK BAKELIKE RED ,932,2011-12,0
22728,ALARM CLOCK BAKELIKE PINK,638,2011-12,0
22729,ALARM CLOCK BAKELIKE ORANGE,385,2011-10,2
22730,ALARM CLOCK BAKELIKE IVORY,491,2011-12,0
22731,3D CHRISTMAS STAMPS STICKERS ,107,2011-12,0
22732,3D VINTAGE CHRISTMAS STICKERS ,127,2011-12,0
22733,3D TRADITIONAL CHRISTMAS STICKERS,144,2011-12,0
22734,SET OF 6 RIBBONS VINTAGE CHRISTMAS,347,2011-12,0
22735,RIBBON REEL SOCKS AND MITTENS,89,2011-12,0
22736,RIBBON REEL MAKING SNOWMEN ,157,2011-12,0
22737,RIBBON REEL CHRISTMAS PRESENT ,192,2011-12,0
22738,RIBBON REEL SNOWY VILLAGE,183,2011-12,0
22739,RIBBON REEL CHRISTMAS SOCK BAUBLE,213,2011-12,0
22740,POLKADOT PEN,107,2011-09,3
22741,FUNKY DIVA PEN,158,2011-12,0
22742,MAKE YOUR OWN PLAYTIME CARD KIT,92,2011-12,0
22743,MAKE YOUR OWN FLOWERPOWER CARD KIT,153,2011-12,0
22744,MAKE YOUR OWN MONSOON CARD KIT,152,2011-12,0
22745,POPPY'S PLAYHOUSE BEDROOM ,329,2011-12,0
22746,POPPY'S PLAYHOUSE LIVINGROOM ,259,2011-12,0
22747,POPPY'S PLAYHOUSE BATHROOM,174,2011-12,0
22748,POPPY'S PLAYHOUSE KITCHEN,360,2011-12,0
22749,FELTCRAFT PRINCESS CHARLOTTE DOLL,421,2011-12,0
22750,FELTCRAFT PRINCESS LOLA DOLL,393,2011-12,0
22751,FELTCRAFT PRINCESS OLIVIA DOLL,256,2011-12,0
22752,SET 7 BABUSHKA NESTING BOXES,306,2011-12,0
22753,SMALL YELLOW BABUSHKA NOTEBOOK ,168,2011-12,0
22754,SMALL RED BABUSHKA NOTEBOOK ,196,2011-12,0
22755,SMALL PURPLE BABUSHKA NOTEBOOK ,198,2011-12,0
22756,LARGE YELLOW BABUSHKA NOTEBOOK ,93,2011-12,0
22757,LARGE RED BABUSHKA NOTEBOOK ,115,2011-12,0
22758,LARGE PURPLE BABUSHKA NOTEBOOK  ,130,2011-12,0
22759,SET OF 3 NOTEBOOKS IN PARCEL,338,2011-11,1
22760,"TRAY, BREAKFAST IN BED",72,2011-09,3
22761,CHEST 7 DRAWER MA CAMPAGNE,25,2011-12,0
22762,CUPBOARD 3 DRAWER MA CAMPAGNE,94,2011-12,0
22763,KEY CABINET MA CAMPAGNE,97,2011-12,0
22764,"RUSTIC WOODEN CABINET, GLASS DOORS",3,2011-03,9
22765,NEWSPAPER STAND,3,2010-12,12
22766,PHOTO FRAME CORNICE,481,2011-12,0
22767,TRIPLE PHOTO FRAME CORNICE ,225,2011-12,0
22768,FAMILY PHOTO FRAME CORNICE,260,2011-12,0
22769,CHALKBOARD KITCHEN ORGANISER,5,2010-12,12
22770,MIRROR CORNICE,59,2011-12,0
22771,CLEAR DRAWER KNOB ACRYLIC EDWARDIAN,338,2011-12,0
22772,PINK DRAWER KNOB ACRYLIC EDWARDIAN,179,2011-12,0
22773,GREEN DRAWER KNOB ACRYLIC EDWARDIAN,150,2011-12,0
22774,RED DRAWER KNOB ACRYLIC EDWARDIAN,103,2011-12,0
22775,PURPLE DRAWERKNOB ACRYLIC EDWARDIAN,163,2011-12,0
22776,"CAKESTAND, 3 TIER, LOVEHEART",1,2010-12,12
22776,SWEETHEART 3 TIER CAKE STAND ,134,2011-12,0
22776,SWEETHEART CAKESTAND 3 TIER,356,2011-10,2
22777,GLASS BELL JAR LARGE,1,2010-12,12
22777,GLASS CLOCHE LARGE,45,2011-07,5
22778,GLASS BELL JAR SMALL,1,2010-12,12
22778,GLASS CLOCHE SMALL,130,2011-11,1
22779,WOODEN OWLS LIGHT GARLAND ,158,2011-12,0
22780,LIGHT GARLAND BUTTERFILES PINK,140,2011-12,0
22781,GUMBALL MAGAZINE RACK,174,2011-12,0
22782,SET 3 WICKER STORAGE BASKETS ,74,2011-12,0
22783,SET 3 WICKER OVAL BASKETS W LIDS,32,2011-06,6
22784,LANTERN CREAM GAZEBO ,296,2011-12,0
22785,SQUARECUSHION COVER PINK UNION FLAG,25,2011-04,8
22785,SQUARECUSHION COVER PINK UNION JACK,29,2011-12,0
22786,CUSHION COVER PINK UNION JACK,37,2011-12,0
22788,BROCANTE COAT RACK,50,2011-06,6
22789,T-LIGHT HOLDER SWEETHEART HANGING,132,2011-12,0
22791,T-LIGHT GLASS FLUTED ANTIQUE,276,2011-12,0
22792,FLUTED ANTIQUE CANDLE HOLDER,131,2011-12,0
22794,SWEETHEART WIRE MAGAZINE RACK,161,2011-12,0
22795,SWEETHEART RECIPE BOOK STAND,294,2011-12,0
22796,PHOTO FRAME 3 CLASSIC HANGING,237,2011-12,0
22797,CHEST OF DRAWERS GINGHAM HEART ,89,2011-12,0
22798,ANTIQUE GLASS DRESSING TABLE POT,206,2011-12,0
22799,SWEETHEART WIRE FRUIT BOWL,80,2011-12,0
22800,ANTIQUE TALL SWIRLGLASS TRINKET POT,144,2011-12,0
22801,ANTIQUE GLASS PEDESTAL BOWL,176,2011-12,0
22802,FAUX FUR CHOCOLATE THROW,35,2011-12,0
22803,IVORY EMBROIDERED QUILT ,25,2011-11,1
22804,CANDLEHOLDER PINK HANGING HEART,360,2011-10,2
22804,PINK HANGING HEART T-LIGHT HOLDER,69,2011-12,0
22805,BLUE DRAWER KNOB ACRYLIC EDWARDIAN,127,2011-12,0
22806,SET OF 6 T-LIGHTS WEDDING CAKE ,28,2011-12,0
22807,SET OF 6 T-LIGHTS TOADSTOOLS,111,2011-12,0
22808,SET OF 6 T-LIGHTS EASTER CHICKS,55,2011-12,0
22809,SET OF 6 T-LIGHTS SANTA,181,2011-12,0
22810,SET OF 6 T-LIGHTS SNOWMEN,143,2011-12,0
22811,SET OF 6 T-LIGHTS CACTI ,57,2011-12,0
22812,PACK 3 BOXES CHRISTMAS PANETTONE,13,2011-12,0
22812,PACK 3 BOXES CHRISTMAS PANNETONE,117,2011-11,1
22813,PACK 3 BOXES BIRD PANETTONE ,14,2011-12,0
22813,PACK 3 BOXES BIRD PANNETONE ,140,2011-11,1
22814,CARD PARTY GAMES ,96,2011-12,0
22815,CARD PSYCHEDELIC APPLES,114,2011-12,0
22816,CARD MOTORBIKE SANTA,180,2011-12,0
22817,CARD SUKI BIRTHDAY,126,2011-12,0
22818,CARD CHRISTMAS VILLAGE,167,2011-12,0
22819,"BIRTHDAY CARD, RETRO SPOT",126,2011-12,0
22820,GIFT BAG BIRTHDAY,47,2011-12,0
22821,GIFT BAG PSYCHEDELIC APPLES,68,2011-12,0
22822,CREAM WALL PLANTER HEART SHAPED,147,2011-12,0
22823,CHEST NATURAL WOOD 20 DRAWERS,13,2011-11,1
22824,3 TIER SWEETHEART GARDEN SHELF,44,2011-11,1
22825,DECORATIVE PLANT POT WITH FRIEZE,26,2011-11,1
22826,LOVE SEAT ANTIQUE WHITE METAL,45,2011-12,0
22827,RUSTIC  SEVENTEEN DRAWER SIDEBOARD,29,2011-11,1
22828,REGENCY MIRROR WITH SHUTTERS,7,2011-11,1
22829,SWEETHEART WIRE WALL TIDY,101,2011-11,1
22830,UTILTY CABINET WITH HOOKS,6,2011-01,11
22831,WHITE BROCANTE SOAP DISH,106,2011-12,0
22832,BROCANTE SHELF WITH HOOKS,74,2011-11,1
22833,HALL CABINET WITH 3 DRAWERS,4,2011-02,10
22834,HAND WARMER BABUSHKA DESIGN,306,2011-12,0
22835,HOT WATER BOTTLE I AM SO POORLY,523,2011-12,0
22837,HOT WATER BOTTLE BABUSHKA ,137,2011-09,3
22837,HOT WATER BOTTLE BABUSHKA LARGE,1,2010-12,12
