StockCode,ProductName,Count,LatestMonth,UnsoldDuration
23307,SET OF 60 PANTRY DESIGN CAKE CASES ,534,2011-12,0
23308,SET OF 60 VINTAGE LEAF CAKE CASES ,317,2011-12,0
23309,SET OF 60 I LOVE LONDON CAKE CASES ,320,2011-12,0
23310,BUBBLEGUM RING ASSORTED,214,2011-12,0
23311,VINTAGE CHRISTMAS STOCKING ,287,2011-12,0
23312,VINTAGE CHRISTMAS GIFT SACK,199,2011-12,0
23313,VINTAGE CHRISTMAS BUNTING,373,2011-12,0
23314,VINTAGE CHRISTMAS TABLECLOTH,108,2011-12,0
23315,IVORY REFECTORY CLOCK,77,2011-12,0
23316,RED REFECTORY CLOCK ,97,2011-12,0
23317,BLUE REFECTORY CLOCK ,71,2011-12,0
23318,BOX OF 6 MINI VINTAGE CRACKERS,344,2011-12,0
23319,BOX OF 6 MINI 50'S CRACKERS,387,2011-12,0
23320,GIANT 50'S CHRISTMAS CRACKER,323,2011-12,0
23321,SMALL WHITE HEART OF WICKER,609,2011-12,0
23322,LARGE WHITE HEART OF WICKER,538,2011-12,0
23323,WHITE WICKER STAR ,285,2011-12,0
23324,RUSTIC STRAWBERRY JAM POT LARGE ,35,2011-11,1
23324,RUSTIC STRAWBERRY JAMPOT LARGE ,6,2011-10,2
23325,RUSTIC STRAWBERRY JAM POT SMALL,30,2011-11,1
23325,RUSTIC STRAWBERRY JAMPOT SMALL,3,2011-10,2
23326,HANGING MINI COLOURED BOTTLES,56,2011-12,0
23327,HANGING CLEAR MINI BOTTLE,37,2011-12,0
23328,SET 6 SCHOOL MILK BOTTLES IN CRATE,294,2011-12,0
23329,DECORATIVE WICKER HEART LARGE,244,2011-12,0
23330,DECORATIVE WICKER HEART MEDIUM,211,2011-12,0
23331,DECORATIVE WICKER HEART SMALL,86,2011-12,0
23332,IVORY WICKER HEART LARGE,282,2011-12,0
23333,IVORY WICKER HEART MEDIUM,233,2011-12,0
23334,IVORY WICKER HEART SMALL,101,2011-12,0
23335,EGG FRYING PAN IVORY ,85,2011-12,0
23336,EGG FRYING PAN PINK ,65,2011-12,0
23337,EGG FRYING PAN MINT ,60,2011-12,0
23338,EGG FRYING PAN RED ,92,2011-12,0
23339,EGG FRYING PAN BLUE ,58,2011-12,0
23340,VINTAGE CHRISTMAS CAKE FRILL,124,2011-12,0
23341,PINK DINER WALL CLOCK,99,2011-12,0
23342,MINT DINER CLOCK,1,2011-09,3
23342,MINT DINER WALL CLOCK,157,2011-12,0
23343,JUMBO BAG VINTAGE CHRISTMAS ,403,2011-12,0
23344,JUMBO BAG 50'S CHRISTMAS ,609,2011-12,0
23345, DOLLY GIRL BEAKER,140,2011-12,0
23346,SPACEBOY BEAKER,143,2011-12,0
23347,I LOVE LONDON BEAKER,74,2011-12,0
23348,CHILDRENS TOY COOKING UTENSIL SET,135,2011-12,0
23349,ROLL WRAP VINTAGE CHRISTMAS,258,2011-12,0
23350,ROLL WRAP VINTAGE SPOT ,256,2011-12,0
23351,ROLL WRAP 50'S CHRISTMAS,280,2011-12,0
23352,ROLL WRAP 50'S RED CHRISTMAS ,165,2011-12,0
23353,6 GIFT TAGS VINTAGE CHRISTMAS ,262,2011-12,0
23354,6 GIFT TAGS 50'S CHRISTMAS ,273,2011-12,0
23355,HOT WATER BOTTLE KEEP CALM,747,2011-12,0
23356,LOVE HOT WATER BOTTLE,475,2011-12,0
23357,HOT WATER BOTTLE SEX BOMB,91,2011-12,0
23358,HOT STUFF HOT WATER BOTTLE,69,2011-12,0
23359,SET OF 12 T-LIGHTS VINTAGE DOILEY,6,2011-10,2
23359,SET OF 12 T-LIGHTS VINTAGE DOILY,71,2011-12,0
23360,SET 8 CANDLES VINTAGE DOILEY,7,2011-10,2
23360,SET 8 CANDLES VINTAGE DOILY,105,2011-12,0
23365,SET 12 COLOUR PENCILS LOVE LONDON,133,2011-12,0
23366,SET 12 COLOUR PENCILS DOILEY,3,2011-10,2
23366,SET 12 COLOURING PENCILS DOILEY,1,2011-10,2
23366,SET 12 COLOURING PENCILS DOILY,141,2011-12,0
23367,SET 12 COLOUR PENCILS SPACEBOY ,239,2011-12,0
23368,SET 12 COLOUR PENCILS DOLLY GIRL ,187,2011-12,0
23369,SET 36 COLOUR PENCILS LOVE LONDON,98,2011-12,0
23370,SET 36 COLOUR PENCILS DOILEY,3,2011-10,2
23370,SET 36 COLOURING PENCILS DOILEY,1,2011-10,2
23370,SET 36 COLOURING PENCILS DOILY,110,2011-12,0
23371,SET 36 COLOUR PENCILS SPACEBOY ,140,2011-12,0
23372,SET 36 COLOUR PENCILS DOLLY GIRL,106,2011-12,0
23373,VINTAGE CHRISTMAS PAPER GIFT BAG,88,2011-12,0
23374,RED SPOT PAPER GIFT BAG,125,2011-12,0
23375,50'S CHRISTMAS PAPER GIFT BAG,90,2011-12,0
23376,PACK OF 12 VINTAGE CHRISTMAS TISSUE,119,2011-12,0
23377,PACK OF 12 DOLLY GIRL TISSUES,85,2011-12,0
23378,PACK OF 12 50'S CHRISTMAS TISSUES,156,2011-12,0
23379,PACK OF 12 RED APPLE TISSUES,51,2011-12,0
23380,PACK OF 12 DOILEY TISSUES,2,2011-10,2
23380,PACK OF 12 VINTAGE DOILY TISSUES,96,2011-12,0
23381,PACK OF 12 VINTAGE LEAF TISSUES ,67,2011-12,0
23382,BOX OF 6 CHRISTMAS CAKE DECORATIONS,167,2011-12,0
23388,WOODLAND MINI BACKPACK,136,2011-12,0
23388,WOODLAND MINI RUCKSACK ,2,2011-10,2
23389,SPACEBOY MINI BACKPACK,209,2011-12,0
23389,SPACEBOY MINI RUCKSACK,4,2011-10,2
23390,DOLLY GIRL MINI BACKPACK,152,2011-12,0
23390,DOLLY GIRL MINI RUCKSACK,2,2011-10,2
23391, I LOVE LONDON MINI BACKPACK,70,2011-12,0
23391, I LOVE LONDON MINI RUCKSACK,1,2011-10,2
23392,SPACEBOY ROCKET LOLLY MAKERS,84,2011-12,0
23393,HOME SWEET HOME CUSHION COVER ,214,2011-12,0
23394,POSTE FRANCE CUSHION COVER,124,2011-12,0
23395,BELLE JARDINIERE CUSHION COVER,190,2011-12,0
23396,BUTTERFLY CUSHION COVER,2,2011-09,3
23396,LA JARDIN BOTANIQUE CUSHION COVER,24,2011-10,2
23396,LE JARDIN BOTANIQUE CUSHION COVER,150,2011-12,0
23397,FOOT STOOL HOME SWEET HOME ,181,2011-11,1
23398,HANGING HEART BONHEUR,67,2011-12,0
23399,HOME SWEET HOME HANGING HEART,191,2011-12,0
23400,SHELF WITH 4 HOOKS HOME SWEET HOME,97,2011-12,0
23401,RUSTIC MIRROR WITH LACE HEART,73,2011-12,0
23402,HOME SWEEET HOME 3 PEG HANGER ,4,2011-09,3
23402,HOME SWEET HOME 3 PEG HANGER ,52,2011-12,0
23403,LETTER HOLDER HOME SWEET HOME,115,2011-12,0
23404,HOME SWEET HOME BLACKBOARD,150,2011-12,0
23405,HOME SWEET HOME 2 DRAWER CABINET,61,2011-12,0
23406,HOME SWEET HOME KEY HOLDER,97,2011-12,0
23407,SET OF 2 TRAYS HOME SWEET HOME,124,2011-12,0
23408,PHOTO FRAME LINEN AND LACE SMALL,62,2011-12,0
23409,PHOTO FRAME LINEN AND LACE LARGE,43,2011-12,0
23410,CURIO CABINET LINEN AND LACE ,19,2011-11,1
23411, TRELLIS COAT RACK,48,2011-12,0
23412,HEART MIRROR ANTIQUE WHITE,73,2011-10,2
23413,DECORATIVE VINTAGE COFFEE  BOX,17,2011-12,0
23413,DECROTIVEVINTAGE COFFEE GRINDER BOX,4,2011-10,2
23413,VINTAGE COFFEE GRINDER BOX,25,2011-10,2
23414,ZINC BOX SIGN HOME,63,2011-11,1
23415,HOME SWEET HOME HOOK,46,2011-12,0
23416,CHAMBRE HOOK,18,2011-12,0
23417,BATHROOM HOOK,22,2011-12,0
23418,LAVENDER TOILETTE BOTTLE,61,2011-12,0
23419,HOME SWEET HOME BOTTLE ,63,2011-12,0
23420,PANTRY HOOK TEA STRAINER ,29,2011-12,0
23421,PANTRY HOOK SPATULA,27,2011-12,0
23422,PANTRY HOOK BALLOON WHISK ,31,2011-12,0
23423,PANTRY 3 HOOK ROLLING PIN HANGER,54,2011-12,0
23424,GINGHAM RECIPE BOOK BOX,105,2011-12,0
23425,STORAGE TIN HOME SWEET HOME,38,2011-12,0
23426,METAL SIGN DROP YOUR PANTS,176,2011-12,0
23427,STOOL HOME SWEET HOME ,110,2011-12,0
23428,IVORY RETRO KITCHEN WALL CLOCK,27,2011-12,0
23429,RED RETRO KITCHEN WALL CLOCK,20,2011-12,0
23430,BLUE RETRO KITCHEN WALL CLOCK,17,2011-12,0
23431,NATURAL HANGING QUILTED HEARTS ,75,2011-12,0
23432,PRETTY HANGING QUILTED HEARTS,72,2011-12,0
23433,HANGING QUILTED PATCHWORK APPLES,85,2011-12,0
23434,3 RAFFIA RIBBONS 50'S CHRISTMAS ,137,2011-12,0
23435,3 RAFFIA RIBBONS VINTAGE CHRISTMAS,45,2011-12,0
23436,GIFT BAG LARGE VINTAGE CHRISTMAS,9,2011-10,2
23436,VINTAGE CHRISTMAS GIFT BAG LARGE ,85,2011-12,0
23437, 50'S CHRISTMAS GIFT BAG LARGE,110,2011-12,0
23437,GIFT BAG LARGE 50'S CHRISTMAS,2,2011-10,2
23438, RED SPOT GIFT BAG LARGE,94,2011-12,0
23438,GIFT BAG LARGE SPOT ,6,2011-10,2
23439,HAND WARMER RED LOVE HEART,399,2011-12,0
23440,PAINT YOUR OWN EGGS IN CRATE,5,2011-12,0
23441,HAND PAINTED HANGING EASTER EGG,3,2011-12,0
23442,12 HANGING EGGS HAND PAINTED,10,2011-12,0
23444,Next Day Carriage,80,2011-12,0
23445,ICE CREAM BUBBLES,97,2011-12,0
23446,BLUE BUNNY EASTER EGG BASKET,3,2011-12,0
23447,PINK BUNNY EASTER EGG BASKET,4,2011-12,0
23448,CREAM BUNNY EASTER EGG BASKET,3,2011-11,1
23449,SET OF 6 EASTER RAINBOW CHICKS,1,2011-11,1
23451,SQUARE MINI PORTRAIT FRAME,46,2011-12,0
23452,HEART MINI PORTRAIT FRAME,82,2011-12,0
23453,OVAL  MINI PORTRAIT FRAME,50,2011-12,0
23454,SET OF 3 MINI HANGING PORTRAITS,2,2011-11,1
23454,THREE MINI HANGING FRAMES,52,2011-12,0
23455,SMALL PARLOUR FRAME,2,2011-11,1
23455,SMALL PARLOUR PICTURE FRAME,33,2011-12,0
23456,MEDIUM PARLOUR FRAME ,2,2011-11,1
23456,MEDIUM PARLOUR PICTURE FRAME ,35,2011-12,0
23457,LARGE PARLOUR FRAME,2,2011-11,1
23457,LARGE PARLOUR PICTURE FRAME,28,2011-12,0
23458,DOLLY CABINET 3 DRAWERS ,34,2011-12,0
23459,DOLLY CABINET 2 DRAWERS ,21,2011-12,0
23460,SWEETHEART WALL TIDY ,47,2011-12,0
23461,SWEETHEART BIRD HOUSE,97,2011-12,0
23462,ROCOCO WALL MIROR,1,2011-10,2
23462,ROCOCO WALL MIRROR WHITE,55,2011-12,0
23463,VINTAGE ZINC WATERING CAN,7,2011-12,0
23464,VINTAGE ZINC WATERING CAN SMALL,6,2011-12,0
23465,TUSCAN VILLA BIRD FEEDER,8,2011-11,1
23465,TUSCAN VILLA FEEDING STATION,7,2011-10,2
23466,TUSCAN VILLA DOVECOTE,4,2011-10,2
23466,TUSCAN VILLA DOVECOTE BIRD FEEDER,18,2011-12,0
23467,VINTAGE ZINC PLANTER  ,5,2011-12,0
23468,TUSCAN VILLA BIRD TABLE ,11,2011-11,1
23469,CARD HOLDER LOVE BIRD SMALL,65,2011-12,0
23470,CARD HOLDER LOVE BIRD LARGE ,83,2011-12,0
23471,SIX DRAWER OFFICE TIDY,27,2011-12,0
23472, NINE DRAWER OFFICE TIDY,31,2011-12,0
23473,WOODLAND SMALL RED FELT HEART,44,2011-12,0
23474,WOODLAND SMALL BLUE FELT HEART,28,2011-12,0
23475,WOODLAND SMALL PINK FELT HEART,26,2011-12,0
23476,WOODLAND LARGE RED FELT HEART,18,2011-11,1
23477,WOODLAND LARGE BLUE FELT HEART,8,2011-11,1
23478,WOODLAND LARGE PINK FELT HEART,10,2011-12,0
23479,WIRE EGG BASKET ,41,2011-12,0
23480,MINI LIGHTS WOODLAND MUSHROOMS,181,2011-12,0
23481,PEARLISED IVORY HEART SMALL ,30,2011-12,0
23482,PEARLISED IVORY HEART LARGE ,36,2011-12,0
23483,HANGING  BUTTERFLY T-LIGHT HOLDER,72,2011-12,0
23484,HEART TRELLIS TRIPLE T-LIGHT HOLDER,21,2011-12,0
23484,HEART TRELLISTRIPLE T-LIGHT HOLDER,5,2011-10,2
23485,BOTANICAL GARDENS WALL CLOCK ,93,2011-12,0
23486,ANTIQUE HEART SHELF UNIT,74,2011-12,0
23487,SWEET HEART CAKE CARRIER,48,2011-12,0
23489,"GARLAND, VINTAGE BELLS",10,2011-11,1
23489,VINTAGE BELLS GARLAND,133,2011-12,0
23490,T-LIGHT HOLDER HANGING LOVE BIRD,97,2011-12,0
23491,VINTAGE JINGLE BELLS HEART,78,2011-12,0
23492,VINTAGE JINGLE BELLS WREATH,26,2011-12,0
23493,VINTAGE DOILY TRAVEL SEWING KIT,367,2011-12,0
23494,VINTAGE DOILY DELUXE SEWING KIT ,190,2011-12,0
23495,SET OF 3 PANTRY WOODEN SPOONS,24,2011-12,0
23496,PANTRY KITCHEN THERMOMETER ,22,2011-12,0
23497,CLASSIC CHROME BICYCLE BELL ,178,2011-12,0
23497,CLASSIC CROME BICYCLE BELL ,2,2011-11,1
23498,CLASSIC BICYCLE CLIPS ,93,2011-12,0
23499,SET 12 VINTAGE DOILY CHALK ,98,2011-12,0
23500,KEY RING BASEBALL BOOT ASSORTED ,93,2011-12,0
23501,KEY RING BASEBALL BOOT UNION JACK,89,2011-12,0
23502,PLAYING CARDS VINTAGE DOILEY ,2,2011-10,2
23502,PLAYING CARDS VINTAGE DOILY ,86,2011-12,0
23503,PLAYING CARDS KEEP CALM & CARRY ON,339,2011-12,0
23504,PLAYING CARDS JUBILEE UNION JACK,203,2011-12,0
23505,PLAYING CARDS I LOVE LONDON ,111,2011-12,0
23506,MINI PLAYING CARDS SPACEBOY ,137,2011-12,0
23507,MINI PLAYING CARDS BUFFALO BILL ,111,2011-12,0
23508,MINI PLAYING CARDS DOLLY GIRL ,119,2011-12,0
23509,MINI PLAYING CARDS FUN FAIR ,57,2011-12,0
23510,MINI PLAYING CARDS GYMKHANA,101,2011-12,0
23511,EMBROIDERED RIBBON REEL EMILY ,89,2011-12,0
23512,EMBROIDERED RIBBON REEL ROSIE,50,2011-12,0
23513,EMBROIDERED RIBBON REEL SUSIE ,63,2011-12,0
23514,EMBROIDERED RIBBON REEL SALLY ,63,2011-12,0
23515,EMBROIDERED RIBBON REEL DAISY ,60,2011-12,0
23516,EMBROIDERED RIBBON REEL SOPHIE  ,43,2011-12,0
23517,EMBROIDERED RIBBON REEL REBECCA ,51,2011-12,0
23518,EMBROIDERED RIBBON REEL RACHEL ,43,2011-12,0
23519,EMBROIDERED RIBBON REEL CLAIRE,19,2011-11,1
23520,EMBROIDERED RIBBON REEL RUBY ,31,2011-12,0
23521,CAT AND BIRD WALL ART,4,2011-10,2
23521,WALL ART CAT AND BIRD ,18,2011-12,0
23522,DOG AND BALL WALL ART,4,2011-10,2
23522,WALL ART DOG AND BALL ,17,2011-12,0
23523,TREASURE AHOY WALL ART,16,2011-11,1
23523,WALL ART TREASURE AHOY ,23,2011-12,0
23524,HORSE & PONY WALL ART,17,2011-11,1
23524,WALL ART HORSE & PONY ,35,2011-12,0
23525,BUFFALO BILL WALL ART ,15,2011-11,1
23525,WALL ART BUFFALO BILL ,31,2011-12,0
23526,DOG LICENCE WALL ART,29,2011-11,1
23526,WALL ART DOG LICENCE ,65,2011-12,0
23527,ANIMALS AND NATURE WALL ART,17,2011-11,1
23527,WALL ART ANIMALS AND NATURE ,29,2011-12,0
23528,SPACEBOY WALL ART,13,2011-11,1
23528,WALL ART SPACEBOY,21,2011-12,0
23529,DOLLY GIRL WALL ART,11,2011-11,1
23529,WALL ART DOLLY GIRL ,19,2011-12,0
23530,WALL ART ONLY ONE PERSON ,74,2011-12,0
23530,"WALL ART,ONLY ONE PERSON ",1,2011-10,2
23531,WALL ART BIG LOVE ,99,2011-12,0
23532,WALL ART WORK REST AND PLAY  ,26,2011-12,0
23533,WALL ART GARDEN HAVEN ,31,2011-12,0
23534,STOP FOR TEA WALL ART,41,2011-12,0
23534,WALL ART STOP FOR TEA ,157,2011-12,0
23535,BICYCLE SAFTEY WALL ART,39,2011-11,1
23535,WALL ART BICYCLE SAFETY,126,2011-12,0
23535,WALL ART BICYCLE SAFTEY ,3,2011-10,2
23536,VILLAGE SHOW WALL ART,18,2011-11,1
23536,WALL ART VILLAGE SHOW ,57,2011-12,0
23537,I LOVE LONDON WALL ART,2,2011-11,1
23537,WALL ART I LOVE LONDON ,19,2011-12,0
23538,WALL ART VINTAGE HEART,28,2011-12,0
23539,"WALL ART , LOVES' SECRET ",2,2011-10,2
23539,WALL ART LOVES' SECRET ,33,2011-12,0
23540,"WALL ART , THE MAGIC FOREST ",1,2011-10,2
23540,WALL ART THE MAGIC FOREST ,9,2011-12,0
23541,"WALL ART ,PUDDINGS ",2,2011-10,2
23541,WALL ART CLASSIC PUDDINGS ,119,2011-11,1
23542,70'S ALPHABET WALL ART,15,2011-11,1
23542,WALL ART 70'S ALPHABET ,58,2011-12,0
23543,KEEP CALM WALL ART ,20,2011-11,1
23543,WALL ART KEEP CALM ,77,2011-12,0
23544,WALL ART MID CENTURY MODERN ,21,2011-12,0
23545,WRAP RED DOILEY,15,2011-08,4
23545,WRAP RED VINTAGE DOILY,69,2011-12,0
23546,WRAP PAISLEY PARK ,121,2011-12,0
23547,WRAP FLOWER SHOP  ,62,2011-12,0
23548,WRAP MAGIC FOREST ,43,2011-12,0
23549,WRAP BIRD GARDEN ,51,2011-12,0
23550,WRAP ALPHABET POSTER  ,63,2011-12,0
23551,PACK OF 12 PAISLEY PARK TISSUES ,100,2011-12,0
23552,BICYCLE PUNCTURE REPAIR KIT ,111,2011-12,0
23553,LANDMARK FRAME CAMDEN TOWN ,63,2011-12,0
23554,LANDMARK FRAME OXFORD STREET,56,2011-12,0
23555,LANDMARK FRAME NOTTING HILL ,52,2011-12,0
23556,LANDMARK FRAME COVENT GARDEN ,56,2011-12,0
23557,LANDMARK FRAME BAKER STREET ,29,2011-12,0
23558,LANDMARK FRAME LONDON BRIDGE ,50,2011-12,0
23559,WOODLAND BUNNIES LOLLY MAKERS,78,2011-12,0
23560,SET OF 6 RIBBONS COUNTRY STYLE,21,2011-12,0
23561,SET OF 6 RIBBONS PARTY,13,2011-12,0
23562,SET OF 6 RIBBONS PERFECTLY PRETTY  ,39,2011-12,0
23564,EGG CUP MILKMAID INGRID,42,2011-12,0
23565,EGG CUP MILKMAID HELGA ,33,2011-12,0
23566,EGG CUP MILKMAID HEIDI,48,2011-12,0
23567,EGG CUP HENRIETTA HEN PINK,20,2011-12,0
23568,EGG CUP HENRIETTA HEN CREAM ,29,2011-12,0
23569,TRADTIONAL ALPHABET STAMP SET,185,2011-12,0
23570,TRADITIONAL PICK UP STICKS GAME ,248,2011-12,0
23571,TRADITIONAL NAUGHTS & CROSSES,227,2011-12,0
23574,PACKING CHARGE,16,2011-12,0
23575,SNACK TRAY PAISLEY PARK,24,2011-12,0
23576,SNACK TRAY RED VINTAGE DOILY,30,2011-12,0
23578,SNACK TRAY RED GINGHAM,11,2011-12,0
23579,SNACK TRAY I LOVE LONDON,26,2011-12,0
23580,SNACK TRAY HAPPY FOREST  ,22,2011-12,0
23581,JUMBO BAG PAISLEY PARK,319,2011-12,0
23582,VINTAGE DOILY JUMBO BAG RED ,244,2011-12,0
23583,LUNCH BAG PAISLEY PARK  ,312,2011-12,0
23597,PAPER BUNTING PAISLEY PARK,31,2011-12,0
23598,PAPER BUNTING VINTAGE PARTY,43,2011-12,0
23630,SET 10 CARDS HANGING BAUBLES 17080,2,2011-09,3
23660,HENRIETTA HEN MUG ,35,2011-12,0
23661,MILK MAIDS MUG ,28,2011-12,0
23664,FLOWER SHOP DESIGN MUG,1,2011-11,1
23681,LUNCH BAG RED VINTAGE DOILY,120,2011-12,0
23691,KEEP CALM BIRTHDAY WRAP,2,2011-11,1
23691,WRAP KEEP CALM BIRTHDAY,36,2011-12,0
23692,WRAP A PRETTY THANK YOU,2,2011-11,1
23694,PAISLEY PARK CARD,24,2011-12,0
23695,DOILY THANK YOU CARD,46,2011-12,0
23697,A PRETTY THANK YOU CARD,27,2011-12,0
23702,High Resolution Image,3,2011-11,1
35241,ENAMEL BLUE RIM BISCUIT BIN,30,2011-05,7
35265,COLOURFUL FLOWER FRUIT BOWL,11,2011-10,2
35400,WOODEN BOX ADVENT CALENDAR ,13,2011-11,1
35443,RASTA IN BATH W SPLIFF ASHTRAY,5,2011-11,1
35645,VINTAGE BEAD PINK JEWEL BOX,3,2011-10,2
35646,VINTAGE BEAD PINK EVENING BAG,46,2011-11,1
35647,VINTAGE BEAD PINK SHADE ,2,2011-03,9
35648,VINTAGE BEAD PINK PURSE ,66,2011-12,0
35649,VINTAGE BEAD COSMETIC BAG ,7,2011-11,1
35650,VINTAGE BEAD PINK JEWEL STAND,1,2011-08,4
35651,VINTAGE BEAD PINK SCARF ,35,2011-11,1
35653,VINTAGE BEAD NOTEBOOK,17,2011-08,4
35832,WOOLLY HAT SOCK GLOVE ADVENT STRING,1,2010-12,12
35914,PINK CHICK EGG WARMER + EGG CUP,19,2011-10,2
35920,FOUR RABBIT EASTER DECORATIONS,11,2011-04,8
35921,EASTER BUNNY HANGING GARLAND,12,2011-07,5
35922,EASTER BUNNY WREATH,10,2011-04,8
35923,CANDY HEART HANGING DECORATION,43,2011-12,0
35924,HANGING FAIRY CAKE DECORATION,38,2011-11,1
35933,PINK STOCKING CHRISTMAS DECORATION,16,2011-11,1
35953,FOLKART STAR CHRISTMAS DECORATIONS,90,2011-12,0
35954,SMALL FOLKART STAR CHRISTMAS DEC,34,2011-11,1
35957,SMALLFOLKART BAUBLE CHRISTMAS DEC,8,2011-01,11
35958,FOLKART ZINC STAR CHRISTMAS DEC,3,2010-12,12
35961,FOLKART ZINC HEART CHRISTMAS DEC,160,2011-12,0
35964,FOLKART CLIP ON STARS,40,2011-12,0
35965,FOLKART HEART NAPKIN RINGS,29,2011-09,3
35966,FOLKART CHRISTMAS TREE T-LIGHT HOLD,2,2011-08,4
35967,FOLK ART METAL STAR T-LIGHT HOLDER,29,2011-12,0
35968,FOLK ART METAL HEART T-LIGHT HOLDER,18,2011-11,1
35970,ZINC FOLKART SLEIGH BELLS,355,2011-12,0
35971,ROSE FOLKART HEART DECORATIONS,58,2011-12,0
35972,DAISY FOLKART HEART DECORATION,17,2011-11,1
37327,ASSTD MULTICOLOUR CIRCLES MUG,49,2011-11,1
37330,BIG POLKADOT MUG,1,2011-03,9
37333,"RETRO ""TEA FOR ONE"" ",11,2011-05,7
37340,MULTICOLOUR SPRING FLOWER MUG,66,2011-12,0
37342,POLKADOT COFFEE CUP & SAUCER PINK,67,2011-09,3
37343,POLKADOT MUG PINK ,8,2011-03,9
37351,ORANGE FLOWER MUG ,1,2011-03,9
37370,RETRO COFFEE MUGS ASSORTED,125,2011-11,1
37413,ICON MUG REVOLUTIONARY,81,2011-12,0
37423,WHITE WITH BLACK CATS PLATE,3,2011-03,9
37446,MINI CAKE STAND WITH HANGING CAKES,171,2011-12,0
37447,CERAMIC CAKE DESIGN SPOTTED PLATE,82,2011-12,0
37448,CERAMIC CAKE DESIGN SPOTTED MUG,173,2011-12,0
37449,CERAMIC CAKE STAND + HANGING CAKES,178,2011-12,0
37450,CERAMIC CAKE BOWL + HANGING CAKES,115,2011-12,0
37461,FUNKY MONKEY MUG,1,2010-12,12
37464,ROBOT MUG IN DISPLAY BOX,2,2010-12,12
37467,PIG MUG IN TWO COLOUR DESIGNS,11,2011-10,2
37468,HARDMAN MUG 3 ASSORTED,13,2011-10,2
37471,MULTICOLOUR POLKADOT PLATE,1,2011-05,7
37475,SET/4 COLOURFUL MIXING BOWLS,30,2011-12,0
37476,CONDIMENT TRAY 4 BOWLS AND 4 SPOONS,9,2011-10,2
37495,FAIRY CAKE BIRTHDAY CANDLE SET,96,2011-12,0
37500,TEA TIME TEAPOT IN GIFT BOX,82,2011-12,0
37501,TEA TIME TEA SET IN GIFT BOX,30,2011-08,4
37503,TEA TIME CAKE STAND IN GIFT BOX,1,2010-12,12
37509,NEW ENGLAND MUG W GIFT BOX,2,2010-12,12
40001,WHITE BAMBOO RIBS LAMPSHADE,41,2011-11,1
40003,WHITE BAMBOO RIBS LAMPSHADE,11,2011-06,6
40016,CHINESE DRAGON PAPER LANTERNS,75,2011-09,3
44228,CANNABIS LEAF BEAD CURTAIN,2,2011-08,4
44234,ASSORTED CIRCULAR MOBILE,24,2011-12,0
44235,ASS COL CIRCLE MOBILE ,7,2011-06,6
44235,ASSORTED COLOURED CIRCLE MOBILE ,9,2011-12,0
44236,PINK/PURPLE CIRCLE CURTAIN,7,2011-08,4
44265,M/COLOUR POM-POM CURTAIN,1,2011-02,10
45013,FOLDING SHOE TIDY,2,2011-10,2
46118,FUNKY MONKEY CUSHION COVER,18,2011-12,0
47016,LIGHT DECORATION BATTERY OPERATED,1,2011-11,1
47420,ASSORTED COLOUR SUCTION CUP HOOK,19,2011-12,0
47421,ASSORTED COLOUR LIZARD SUCTION HOOK,63,2011-12,0
47422,ASSORTED MONKEY SUCTION CUP HOOK,56,2011-12,0
47469,ASSORTED SHAPES PHOTO CLIP SILVER ,17,2011-12,0
47471,RAINBOW PEGS PHOTO CLIP STRING,26,2011-12,0
47480,HANGING PHOTO CLIP ROPE LADDER,54,2011-12,0
47481,50CM METAL STRING WITH  7 CLIPS,20,2011-11,1
47566,PARTY BUNTING,1416,2011-12,0
47579,TEA TIME BREAKFAST BASKET,1,2010-12,12
47580,TEA TIME DES TEA COSY,80,2011-12,0
47589,CONGRATULATIONS BUNTING,3,2011-05,7
48111,DOORMAT 3 SMILEY CATS,178,2011-12,0
48116,DOORMAT MULTICOLOUR STRIPE,144,2011-12,0
48129,DOORMAT TOPIARY,187,2011-12,0
48138,DOORMAT UNION FLAG,527,2011-12,0
48184,DOORMAT ENGLISH ROSE ,361,2011-12,0
48185,DOORMAT FAIRY CAKE,247,2011-12,0
48187,DOORMAT NEW ENGLAND,539,2011-12,0
48188,DOORMAT WELCOME PUPPIES,256,2011-12,0
48194,DOORMAT HEARTS,486,2011-12,0
51008,AFGHAN SLIPPER SOCK PAIR,20,2011-12,0
62018,SOMBRERO ,59,2011-12,0
70006,LOVE HEART POCKET WARMER,81,2011-12,0
70007,HI TEC ALPINE HAND WARMER,59,2011-12,0
71038,WHITE HANGING BEADS CANDLE HOLDER,51,2011-11,1
71050,SMALL SINGLE FLAME CANDLE HOLDER,6,2011-12,0
71053,WHITE METAL LANTERN,259,2011-11,1
71053,WHITE MOROCCAN METAL LANTERN,13,2011-12,0
71143,SILVER BOOK MARK WITH BEADS,1,2011-06,6
71215,METAL BASE FOR CANDLES,2,2011-05,7
71270,PHOTO CLIP LINE,35,2011-12,0
71279,PINK GLASS CANDLEHOLDER,33,2011-11,1
71403,"PINK/WHITE ""KEEP CLEAN"" BULLET BIN",14,2011-11,1
71459,HANGING JAM JAR T-LIGHT HOLDER,321,2011-09,3
71459,HANGING JAM JAR T-LIGHT HOLDERS,70,2011-12,0
71477,COLOUR GLASS. STAR T-LIGHT HOLDER,248,2011-11,1
71477,COLOURED GLASS STAR T-LIGHT HOLDER,51,2011-12,0
71510,SQUARE METAL CANDLEHOLDER BASE,8,2011-11,1
72122,COFFEE SCENT PILLAR CANDLE,46,2011-12,0
72127,COLUMBIAN CANDLE ROUND ,30,2011-11,1
72128,COLUMBIAN CANDLE ROUND,33,2011-11,1
72130,COLUMBIAN CANDLE ROUND,25,2011-11,1
72131,COLUMBIAN CANDLE RECTANGLE,19,2011-11,1
72132,COLUMBIAN CUBE CANDLE,12,2011-11,1
72133,COLUMBIAN CANDLE RECTANGLE,14,2011-12,0
72134,COLUMBIAN  CUBE CANDLE ,8,2011-10,2
72232,FENG SHUI PILLAR CANDLE,66,2011-12,0
72586,SET OF 6 HALLOWEEN GHOST T-LIGHTS,39,2011-12,0
72598,SET/12 TAPER CANDLES,43,2011-12,0
72709,IVORY SCULPTED RND CANDLE ,7,2011-11,1
72741,GRAND CHOCOLATECANDLE,259,2011-12,0
72780,BLACK SILOUETTE CANDLE PLATE,20,2011-12,0
72783,BLACK SIL'T SQU CANDLE PLATE ,2,2011-12,0
72811,SMALL ZINC/GLASS CANDLEHOLDER,6,2011-12,0
72812,LARGE ZINC GLASS CANDLEHOLDER,4,2011-12,0
72815,3 WICK CHRISTMAS BRIAR CANDLE ,2,2011-01,11
72816,SET/3 CHRISTMAS DECOUPAGE CANDLES,33,2011-10,2
72817,SET OF 2 CHRISTMAS DECOUPAGE CANDLE,97,2011-11,1
72818,CHRISTMAS DECOUPAGE CANDLE,66,2011-10,2
72819,CUPID DESIGN SCENTED CANDLES,30,2011-12,0
72821,CUPID SCENTED CANDLE IN GLASS,4,2011-02,10
75011,BLUE DAISY MOBILE,12,2011-11,1
75131,METAL TUBE CHIME ON BAMBOO,13,2011-04,8
75172,PAINTED SEA SHELL METAL WINDCHIME,8,2011-07,5
75178,ASSTD COL BUTTERFLY/CRYSTAL W/CHIME,9,2011-12,0
77079,DOLPHIN WINDMILL,1,2011-06,6
78033,FLAG OF ST GEORGE CHAIR,9,2011-10,2
78124,MAGAZINE RACK GEBRA ASSORTED ,18,2011-11,1
79000,MOROCCAN TEA GLASS,101,2011-09,3
79067,CORONA MEXICAN TRAY,18,2010-12,12
79160,HEART SHAPE WIRELESS DOORBELL,57,2011-12,0
79163,BLACK CHAMPAGNE GLASS,36,2011-09,3
79164,BLACK WINE GLASS,22,2011-11,1
79320,FLAMINGO LIGHTS,1,2011-01,11
79321,CHILLI LIGHTS,530,2011-12,0
79329,PINK FLOCK GLASS CANDLEHOLDER,2,2011-04,8
79331,PINK FLOCK GLASS CANDLEHOLDER,3,2011-04,8
79336,LIGHT PINK FLOCK GLASS CANDLEHOLDER,3,2011-09,3
79337,BLUE FLOCK GLASS CANDLEHOLDER,11,2011-07,5
79403,FROSTED WHITE BASE ,11,2011-12,0
79406,FROSTED WHITE BASE ,6,2011-11,1
82095,HEART BUTTONS JEWELLERY BOX,4,2011-03,9
82482,WOODEN PICTURE FRAME WHITE FINISH,905,2011-12,0
82483,WOOD 2 DRAWER CABINET WHITE FINISH,566,2011-12,0
82484,WOOD BLACK BOARD ANT WHITE FINISH,617,2011-12,0
82486,3 DRAWER ANTIQUE WHITE WOOD CABINET,196,2011-12,0
82486,WOOD S/3 CABINET ANT WHITE FINISH,394,2011-10,2
82551,LAUNDRY 15C METAL SIGN,258,2011-12,0
82552,WASHROOM METAL SIGN,299,2011-12,0
82567,"AIRLINE LOUNGE,METAL SIGN",151,2011-12,0
82578,KITCHEN METAL SIGN,225,2011-12,0
82580,BATHROOM METAL SIGN,393,2011-12,0
82581,TOILET METAL SIGN,308,2011-12,0
82582,AREA PATROLLED METAL SIGN,382,2011-12,0
82583,HOT BATHS METAL SIGN,414,2011-12,0
82599,FANNY'S REST STOPMETAL SIGN,87,2011-05,7
82600,N0 SINGING METAL SIGN,35,2011-12,0
82600,NO SINGING METAL SIGN,392,2011-10,2
82605,OLD DOC RUSSEL METAL SIGN,3,2011-03,9
82615,PINK MARSHMALLOW SCARF KNITTING KIT,1,2010-12,12
84006,MAGIC TREE -PAPER FLOWERS,79,2011-12,0
84012,MAGIC SHEEP WOOL GROWING FROM PAPER,96,2011-12,0
84016,FLAG OF ST GEORGE CAR FLAG,1,2011-09,3
84033,FLAG OF ST GEORGE ,7,2011-09,3
84050,PINK HEART SHAPE EGG FRYING PAN,209,2011-11,1
84051,ASS COLOUR GLOWING TIARAS,26,2011-12,0
84077,WORLD WAR 2 GLIDERS ASSTD DESIGNS,478,2011-12,0
84192,ASSORTED COLOUR METAL CAT ,28,2011-12,0
84199,GLOW IN DARK DOLPHINS,30,2011-12,0
84212,"ASSORTED FLOWER COLOUR ""LEIS""",103,2011-12,0
84218,BOX/12 CHICK & EGG IN BASKET,40,2011-03,9
84226,HEN HOUSE W FAMILY IN BARN & NEST,9,2011-06,6
84227,HEN HOUSE W CHICK IN NEST,1,2011-03,9
84228,HEN HOUSE W CHICK STANDING,17,2011-03,9
84228,HEN HOUSE WITH CHICK STANDING,3,2011-11,1
84231,EASTER BUNNY WITH BASKET ON BACK,19,2011-11,1
84306,S/3 PINK SQUARE PLANTERS ROSES,2,2011-03,9
84347,ROTATING SILVER ANGELS T-LIGHT HLDR,330,2011-12,0
84352,SILVER CHRISTMAS TREE BAUBLE STAND ,25,2011-09,3
84356,POMPOM CURTAIN,46,2011-12,0
84358,FLOOR LAMP SHADE WOOD BASE,12,2011-08,4
84360,TABLE LAMP WHITE SHADE WOOD BASE,17,2011-12,0
84375,SET OF 20 KIDS COOKIE CUTTERS,430,2011-12,0
84378,SET OF 3 HEART COOKIE CUTTERS,536,2011-12,0
84380,SET OF 3 BUTTERFLY COOKIE CUTTERS,515,2011-12,0
84388,WISE MAN STAR SHAPE EGG PAN,6,2011-04,8
84422,PINK/BLUE DISC/MIRROR STRING,9,2011-09,3
84452,METAL RABBIT LADDER EASTER ,17,2011-10,2
84457,SET/3 RABBITS FLOWER SKIPPPING ROPE,23,2011-11,1
84461,12 PINK HEN+CHICKS IN BASKET,15,2011-04,8
84462,3 PINK HEN+CHICKS IN BASKET,6,2011-04,8
84465,15 PINK FLUFFY CHICKS IN BOX,7,2011-11,1
84466,TOP SECRET PEN SET,10,2011-07,5
84497,BUTTONS AND STRIPES NOTEBOOK ,7,2011-11,1
84499,BLACK FLOWER CANDLE PLATE,2,2011-01,11
84522,PINK PARTY SUNGLASSES,6,2011-11,1
84527,FLAMES SUNGLASSES PINK LENSES,6,2011-11,1
84539,KNITTED RABBIT DOLL ,1,2011-07,5
84548,CROCHET BEAR RED/BLUE  KEYRING,4,2011-07,5
84549,CROCHET WHITE RABBIT KEYRING ,3,2011-07,5
84550,CROCHET LILAC/RED BEAR KEYRING,1,2011-11,1
84551,CROCHET DOG KEYRING,1,2011-06,6
84568,GIRLS ALPHABET IRON ON PATCHES ,24,2011-11,1
84576,BLUE CAT BISCUIT BARREL PINK HEART,9,2011-07,5
84580,MOUSE TOY WITH PINK T-SHIRT,123,2011-12,0
84581,DOG TOY WITH PINK CROCHET SKIRT,71,2011-12,0
84584,PINK GINGHAM CAT WITH SCARF,18,2011-07,5
84592,CROCHET ROSE PURSE WITH SUEDE BACK,17,2011-11,1
84593,CROCHET ROSE DES CLOTHES HANGER,2,2011-03,9
84598,BOYS ALPHABET IRON ON PATCHES,6,2011-11,1
84600,NEW BAROQUE JEWELLERY BOX ,21,2011-12,0
84609,TALL ROCOCO CANDLE HOLDER,18,2011-12,0
84616,SILVER ROCCOCO CHANDELIER,8,2011-11,1
84617,NEW BAROQUE BLACK BOXES,3,2011-11,1
84620,BLUE GINGHAM ROSE CUSHION COVER,1,2010-12,12
84629,WHITE 3 FRAME BIRDS AND TREE ,11,2011-08,4
84631,FRUIT TREE AND BIRDS WALL PLAQUE,12,2011-06,6
84632,DECORATIVE HANGING SHELVING UNIT,6,2011-07,5
